model_runtime,lat,lon,datetime,pc4,advies,wind_bft,wind_ms,lki,final
13-10-2025 10:00,52.089770561127374,5.109876746789877,2025-10-13T12:00:00+02:00,3511,code_red,2,2.5,1,True
13-10-2025 10:00,52.089770561127374,5.109876746789877,2025-10-13T18:00:00+02:00,3511,code_red,2,2.5,1,True
13-10-2025 10:00,52.089770561127374,5.109876746789877,2025-10-14T00:00:00+02:00,3511,code_red,2,2.5,1,False
13-10-2025 10:00,52.089770561127374,5.109876746789877,2025-10-14T06:00:00+02:00,3511,code_red,2,2.5,1,False
13-10-2025 16:00,52.089770561127374,5.109876746789877,2025-10-13T18:00:00+02:00,3511,code_red,2,2.1,1,True
13-10-2025 16:00,52.089770561127374,5.109876746789877,2025-10-14T00:00:00+02:00,3511,code_red,2,2.1,1,True
13-10-2025 16:00,52.089770561127374,5.109876746789877,2025-10-14T06:00:00+02:00,3511,code_red,2,2.1,1,False
13-10-2025 16:00,52.089770561127374,5.109876746789877,2025-10-14T12:00:00+02:00,3511,code_red,2,2.1,1,False
14-10-2025 10:00,52.089770561127374,5.109876746789877,2025-10-14T12:00:00+02:00,3511,code_red,2,3.3,1,True
14-10-2025 10:00,52.089770561127374,5.109876746789877,2025-10-14T18:00:00+02:00,3511,code_red,2,3.3,1,True
14-10-2025 10:00,52.089770561127374,5.109876746789877,2025-10-15T00:00:00+02:00,3511,code_red,2,3.3,1,False
14-10-2025 10:00,52.089770561127374,5.109876746789877,2025-10-15T06:00:00+02:00,3511,code_red,2,3.3,1,False
14-10-2025 22:00,52.089770561127374,5.109876746789877,2025-10-15T00:00:00+02:00,3511,code_red,2,2.6,1,True
14-10-2025 22:00,52.089770561127374,5.109876746789877,2025-10-15T06:00:00+02:00,3511,code_red,2,2.6,1,True
14-10-2025 22:00,52.089770561127374,5.109876746789877,2025-10-15T12:00:00+02:00,3511,code_red,2,2.6,1,False
14-10-2025 22:00,52.089770561127374,5.109876746789877,2025-10-15T18:00:00+02:00,3511,code_red,2,2.6,1,False
15-10-2025 04:00,52.089770561127374,5.109876746789877,2025-10-15T06:00:00+02:00,3511,code_red,2,2.5,1,True
15-10-2025 04:00,52.089770561127374,5.109876746789877,2025-10-15T12:00:00+02:00,3511,code_red,2,2.5,1,True
15-10-2025 04:00,52.089770561127374,5.109876746789877,2025-10-15T18:00:00+02:00,3511,code_red,2,2.5,1,False
15-10-2025 04:00,52.089770561127374,5.109876746789877,2025-10-16T00:00:00+02:00,3511,code_red,2,2.5,1,False
15-10-2025 10:00,52.089770561127374,5.109876746789877,2025-10-15T12:00:00+02:00,3511,code_red,2,2.2,1,True
15-10-2025 10:00,52.089770561127374,5.109876746789877,2025-10-15T18:00:00+02:00,3511,code_red,2,2.2,1,True
15-10-2025 10:00,52.089770561127374,5.109876746789877,2025-10-16T00:00:00+02:00,3511,code_red,2,2.2,1,False
15-10-2025 10:00,52.089770561127374,5.109876746789877,2025-10-16T06:00:00+02:00,3511,code_red,2,2.2,1,False
15-10-2025 16:00,52.089770561127374,5.109876746789877,2025-10-15T18:00:00+02:00,3511,code_red,2,2.1,1,True
15-10-2025 16:00,52.089770561127374,5.109876746789877,2025-10-16T00:00:00+02:00,3511,code_red,2,2.1,1,True
15-10-2025 16:00,52.089770561127374,5.109876746789877,2025-10-16T06:00:00+02:00,3511,code_red,2,2.1,1,False
15-10-2025 16:00,52.089770561127374,5.109876746789877,2025-10-16T12:00:00+02:00,3511,code_red,2,2.1,1,False
15-10-2025 22:00,52.089770561127374,5.109876746789877,2025-10-16T00:00:00+02:00,3511,code_red,2,1.9,1,True
15-10-2025 22:00,52.089770561127374,5.109876746789877,2025-10-16T06:00:00+02:00,3511,code_red,2,1.9,1,True
15-10-2025 22:00,52.089770561127374,5.109876746789877,2025-10-16T12:00:00+02:00,3511,code_red,2,1.9,1,False
15-10-2025 22:00,52.089770561127374,5.109876746789877,2025-10-16T18:00:00+02:00,3511,code_red,2,1.9,1,False
16-10-2025 04:00,52.089770561127374,5.109876746789877,2025-10-16T06:00:00+02:00,3511,code_red,2,2.2,1,True
16-10-2025 04:00,52.089770561127374,5.109876746789877,2025-10-16T12:00:00+02:00,3511,code_red,2,2.2,1,True
16-10-2025 04:00,52.089770561127374,5.109876746789877,2025-10-16T18:00:00+02:00,3511,code_red,2,2.2,1,False
16-10-2025 04:00,52.089770561127374,5.109876746789877,2025-10-17T00:00:00+02:00,3511,code_red,2,2.2,1,False
16-10-2025 10:00,52.089770561127374,5.109876746789877,2025-10-16T12:00:00+02:00,3511,code_red,2,2.8,1,True
16-10-2025 10:00,52.089770561127374,5.109876746789877,2025-10-16T18:00:00+02:00,3511,code_red,2,2.8,1,True
16-10-2025 10:00,52.089770561127374,5.109876746789877,2025-10-17T00:00:00+02:00,3511,code_red,2,2.8,1,False
16-10-2025 10:00,52.089770561127374,5.109876746789877,2025-10-17T06:00:00+02:00,3511,code_red,2,2.8,1,False
16-10-2025 16:00,52.089770561127374,5.109876746789877,2025-10-16T18:00:00+02:00,3511,code_red,2,2.2,1,True
16-10-2025 16:00,52.089770561127374,5.109876746789877,2025-10-17T00:00:00+02:00,3511,code_red,2,2.2,1,True
16-10-2025 16:00,52.089770561127374,5.109876746789877,2025-10-17T06:00:00+02:00,3511,code_red,2,2.2,1,False
16-10-2025 16:00,52.089770561127374,5.109876746789877,2025-10-17T12:00:00+02:00,3511,code_red,2,2.2,1,False
16-10-2025 22:00,52.089770561127374,5.109876746789877,2025-10-17T00:00:00+02:00,3511,code_red,2,2.5,1,True
16-10-2025 22:00,52.089770561127374,5.109876746789877,2025-10-17T06:00:00+02:00,3511,code_red,2,2.5,1,True
16-10-2025 22:00,52.089770561127374,5.109876746789877,2025-10-17T12:00:00+02:00,3511,code_red,2,2.5,1,False
16-10-2025 22:00,52.089770561127374,5.109876746789877,2025-10-17T18:00:00+02:00,3511,code_red,2,2.5,1,False
17-10-2025 04:00,52.089770561127374,5.109876746789877,2025-10-17T06:00:00+02:00,3511,code_red,2,2.8,1,True
17-10-2025 04:00,52.089770561127374,5.109876746789877,2025-10-17T12:00:00+02:00,3511,code_red,2,2.8,1,True
17-10-2025 04:00,52.089770561127374,5.109876746789877,2025-10-17T18:00:00+02:00,3511,code_red,2,2.8,1,False
17-10-2025 04:00,52.089770561127374,5.109876746789877,2025-10-18T00:00:00+02:00,3511,code_red,2,2.8,1,False
17-10-2025 10:00,52.089770561127374,5.109876746789877,2025-10-17T12:00:00+02:00,3511,code_red,2,2.4,1,True
17-10-2025 10:00,52.089770561127374,5.109876746789877,2025-10-17T18:00:00+02:00,3511,code_red,2,2.4,1,True
17-10-2025 10:00,52.089770561127374,5.109876746789877,2025-10-18T00:00:00+02:00,3511,code_red,2,2.4,1,False
17-10-2025 10:00,52.089770561127374,5.109876746789877,2025-10-18T06:00:00+02:00,3511,code_red,2,2.4,1,False
17-10-2025 16:00,52.089770561127374,5.109876746789877,2025-10-17T18:00:00+02:00,3511,code_red,2,1.6,1,True
17-10-2025 16:00,52.089770561127374,5.109876746789877,2025-10-18T00:00:00+02:00,3511,code_red,2,1.6,1,True
17-10-2025 16:00,52.089770561127374,5.109876746789877,2025-10-18T06:00:00+02:00,3511,code_red,2,1.6,1,False
17-10-2025 16:00,52.089770561127374,5.109876746789877,2025-10-18T12:00:00+02:00,3511,code_red,2,1.6,1,False
17-10-2025 22:00,52.089770561127374,5.109876746789877,2025-10-18T00:00:00+02:00,3511,code_red,1,1.3,1,True
17-10-2025 22:00,52.089770561127374,5.109876746789877,2025-10-18T06:00:00+02:00,3511,code_red,1,1.3,1,True
17-10-2025 22:00,52.089770561127374,5.109876746789877,2025-10-18T12:00:00+02:00,3511,code_red,1,1.3,1,False
17-10-2025 22:00,52.089770561127374,5.109876746789877,2025-10-18T18:00:00+02:00,3511,code_yellow,1,1.3,1,False
18-10-2025 04:00,52.089770561127374,5.109876746789877,2025-10-18T06:00:00+02:00,3511,code_red,2,2.8,1,True
18-10-2025 04:00,52.089770561127374,5.109876746789877,2025-10-18T12:00:00+02:00,3511,code_red,2,2.8,1,True
18-10-2025 04:00,52.089770561127374,5.109876746789877,2025-10-18T18:00:00+02:00,3511,code_yellow,2,2.8,1,False
18-10-2025 04:00,52.089770561127374,5.109876746789877,2025-10-19T00:00:00+02:00,3511,code_yellow,2,2.8,1,False
18-10-2025 10:00,52.089770561127374,5.109876746789877,2025-10-18T12:00:00+02:00,3511,code_red,2,2.7,1,True
18-10-2025 10:00,52.089770561127374,5.109876746789877,2025-10-18T18:00:00+02:00,3511,code_yellow,2,2.7,1,True
18-10-2025 10:00,52.089770561127374,5.109876746789877,2025-10-19T00:00:00+02:00,3511,code_yellow,2,2.7,1,False
18-10-2025 10:00,52.089770561127374,5.109876746789877,2025-10-19T06:00:00+02:00,3511,code_yellow,2,2.7,1,False
18-10-2025 16:00,52.089770561127374,5.109876746789877,2025-10-18T18:00:00+02:00,3511,code_yellow,3,3.5,1,True
18-10-2025 16:00,52.089770561127374,5.109876746789877,2025-10-19T00:00:00+02:00,3511,code_yellow,3,3.5,1,True
18-10-2025 16:00,52.089770561127374,5.109876746789877,2025-10-19T06:00:00+02:00,3511,code_yellow,3,3.5,1,False
18-10-2025 16:00,52.089770561127374,5.109876746789877,2025-10-19T12:00:00+02:00,3511,code_yellow,3,3.5,1,False
18-10-2025 22:00,52.089770561127374,5.109876746789877,2025-10-19T00:00:00+02:00,3511,code_yellow,3,3.9,1,True
18-10-2025 22:00,52.089770561127374,5.109876746789877,2025-10-19T06:00:00+02:00,3511,code_yellow,3,3.9,1,True
18-10-2025 22:00,52.089770561127374,5.109876746789877,2025-10-19T12:00:00+02:00,3511,code_yellow,3,3.9,1,False
18-10-2025 22:00,52.089770561127374,5.109876746789877,2025-10-19T18:00:00+02:00,3511,code_yellow,3,3.9,1,False
19-10-2025 04:00,52.089770561127374,5.109876746789877,2025-10-19T06:00:00+02:00,3511,code_yellow,3,4.4,1,True
19-10-2025 04:00,52.089770561127374,5.109876746789877,2025-10-19T12:00:00+02:00,3511,code_yellow,3,4.4,1,True
19-10-2025 04:00,52.089770561127374,5.109876746789877,2025-10-19T18:00:00+02:00,3511,code_yellow,3,4.4,1,False
19-10-2025 04:00,52.089770561127374,5.109876746789877,2025-10-20T00:00:00+02:00,3511,code_yellow,3,4.4,1,False
19-10-2025 10:00,52.089770561127374,5.109876746789877,2025-10-19T12:00:00+02:00,3511,code_yellow,3,4.3,1,True
19-10-2025 10:00,52.089770561127374,5.109876746789877,2025-10-19T18:00:00+02:00,3511,code_yellow,3,4.3,1,True
19-10-2025 10:00,52.089770561127374,5.109876746789877,2025-10-20T00:00:00+02:00,3511,code_yellow,3,4.3,1,False
19-10-2025 10:00,52.089770561127374,5.109876746789877,2025-10-20T06:00:00+02:00,3511,code_yellow,3,4.3,1,False
19-10-2025 16:00,52.089770561127374,5.109876746789877,2025-10-19T18:00:00+02:00,3511,code_yellow,3,5.1,2,True
19-10-2025 16:00,52.089770561127374,5.109876746789877,2025-10-20T00:00:00+02:00,3511,code_yellow,3,5.1,2,True
19-10-2025 16:00,52.089770561127374,5.109876746789877,2025-10-20T06:00:00+02:00,3511,code_yellow,3,5.1,2,False
19-10-2025 16:00,52.089770561127374,5.109876746789877,2025-10-20T12:00:00+02:00,3511,code_yellow,3,5.1,2,False
19-10-2025 22:00,52.089770561127374,5.109876746789877,2025-10-20T00:00:00+02:00,3511,code_yellow,3,5.3,2,True
19-10-2025 22:00,52.089770561127374,5.109876746789877,2025-10-20T06:00:00+02:00,3511,code_yellow,3,5.3,2,True
19-10-2025 22:00,52.089770561127374,5.109876746789877,2025-10-20T12:00:00+02:00,3511,code_yellow,3,5.3,2,False
19-10-2025 22:00,52.089770561127374,5.109876746789877,2025-10-20T18:00:00+02:00,3511,code_yellow,3,5.3,2,False
20-10-2025 04:00,52.089770561127374,5.109876746789877,2025-10-20T06:00:00+02:00,3511,code_yellow,3,4.6,1,True
20-10-2025 04:00,52.089770561127374,5.109876746789877,2025-10-20T12:00:00+02:00,3511,code_yellow,3,4.6,1,True
20-10-2025 04:00,52.089770561127374,5.109876746789877,2025-10-20T18:00:00+02:00,3511,code_yellow,3,4.6,1,False
20-10-2025 04:00,52.089770561127374,5.109876746789877,2025-10-21T00:00:00+02:00,3511,code_yellow,3,4.6,1,False
20-10-2025 10:00,52.089770561127374,5.109876746789877,2025-10-20T12:00:00+02:00,3511,code_yellow,3,4.6,1,True
20-10-2025 10:00,52.089770561127374,5.109876746789877,2025-10-20T18:00:00+02:00,3511,code_yellow,3,4.6,1,True
20-10-2025 10:00,52.089770561127374,5.109876746789877,2025-10-21T00:00:00+02:00,3511,code_yellow,3,4.6,1,False
20-10-2025 10:00,52.089770561127374,5.109876746789877,2025-10-21T06:00:00+02:00,3511,code_yellow,3,4.6,1,False
20-10-2025 16:00,52.089770561127374,5.109876746789877,2025-10-20T18:00:00+02:00,3511,code_yellow,3,5.4,2,True
20-10-2025 16:00,52.089770561127374,5.109876746789877,2025-10-21T00:00:00+02:00,3511,code_yellow,3,5.4,2,True
20-10-2025 16:00,52.089770561127374,5.109876746789877,2025-10-21T06:00:00+02:00,3511,code_yellow,3,5.4,2,False
20-10-2025 16:00,52.089770561127374,5.109876746789877,2025-10-21T12:00:00+02:00,3511,code_yellow,3,5.4,2,False
20-10-2025 22:00,52.089770561127374,5.109876746789877,2025-10-21T00:00:00+02:00,3511,code_yellow,4,7.4,1,True
20-10-2025 22:00,52.089770561127374,5.109876746789877,2025-10-21T06:00:00+02:00,3511,code_yellow,4,7.4,1,True
20-10-2025 22:00,52.089770561127374,5.109876746789877,2025-10-21T12:00:00+02:00,3511,code_yellow,4,7.4,1,False
20-10-2025 22:00,52.089770561127374,5.109876746789877,2025-10-21T18:00:00+02:00,3511,code_yellow,4,7.4,1,False
21-10-2025 04:00,52.089770561127374,5.109876746789877,2025-10-21T06:00:00+02:00,3511,code_yellow,4,6.5,1,True
21-10-2025 04:00,52.089770561127374,5.109876746789877,2025-10-21T12:00:00+02:00,3511,code_yellow,4,6.5,1,True
21-10-2025 04:00,52.089770561127374,5.109876746789877,2025-10-21T18:00:00+02:00,3511,code_yellow,4,6.5,1,False
21-10-2025 04:00,52.089770561127374,5.109876746789877,2025-10-22T00:00:00+02:00,3511,code_yellow,4,6.5,1,False
21-10-2025 10:00,52.089770561127374,5.109876746789877,2025-10-21T12:00:00+02:00,3511,code_yellow,3,5.4,1,True
21-10-2025 10:00,52.089770561127374,5.109876746789877,2025-10-21T18:00:00+02:00,3511,code_yellow,3,5.4,1,True
21-10-2025 10:00,52.089770561127374,5.109876746789877,2025-10-22T00:00:00+02:00,3511,code_yellow,3,5.4,1,False
21-10-2025 10:00,52.089770561127374,5.109876746789877,2025-10-22T06:00:00+02:00,3511,code_yellow,3,5.4,1,False
21-10-2025 16:00,52.089770561127374,5.109876746789877,2025-10-21T18:00:00+02:00,3511,code_yellow,3,5.0,1,True
21-10-2025 16:00,52.089770561127374,5.109876746789877,2025-10-22T00:00:00+02:00,3511,code_yellow,3,5.0,1,True
21-10-2025 16:00,52.089770561127374,5.109876746789877,2025-10-22T06:00:00+02:00,3511,code_yellow,3,5.0,1,False
21-10-2025 16:00,52.089770561127374,5.109876746789877,2025-10-22T12:00:00+02:00,3511,code_red,3,5.0,1,False
21-10-2025 22:00,52.089770561127374,5.109876746789877,2025-10-22T00:00:00+02:00,3511,code_yellow,3,4.6,1,True
21-10-2025 22:00,52.089770561127374,5.109876746789877,2025-10-22T06:00:00+02:00,3511,code_yellow,3,4.6,1,True
21-10-2025 22:00,52.089770561127374,5.109876746789877,2025-10-22T12:00:00+02:00,3511,code_red,3,4.6,1,False
21-10-2025 22:00,52.089770561127374,5.109876746789877,2025-10-22T18:00:00+02:00,3511,code_red,3,4.6,1,False
22-10-2025 04:00,52.089770561127374,5.109876746789877,2025-10-22T06:00:00+02:00,3511,code_yellow,3,3.5,1,True
22-10-2025 04:00,52.089770561127374,5.109876746789877,2025-10-22T12:00:00+02:00,3511,code_red,3,3.5,1,True
22-10-2025 04:00,52.089770561127374,5.109876746789877,2025-10-22T18:00:00+02:00,3511,code_red,3,3.5,1,False
22-10-2025 04:00,52.089770561127374,5.109876746789877,2025-10-23T00:00:00+02:00,3511,code_yellow,3,3.5,1,False
22-10-2025 10:00,52.089770561127374,5.109876746789877,2025-10-22T12:00:00+02:00,3511,code_red,2,2.6,1,True
22-10-2025 10:00,52.089770561127374,5.109876746789877,2025-10-22T18:00:00+02:00,3511,code_red,2,2.6,1,True
22-10-2025 10:00,52.089770561127374,5.109876746789877,2025-10-23T00:00:00+02:00,3511,code_yellow,2,2.6,1,False
22-10-2025 10:00,52.089770561127374,5.109876746789877,2025-10-23T06:00:00+02:00,3511,code_yellow,2,2.6,1,False
22-10-2025 16:00,52.089770561127374,5.109876746789877,2025-10-22T18:00:00+02:00,3511,code_red,2,2.9,1,True
22-10-2025 16:00,52.089770561127374,5.109876746789877,2025-10-23T00:00:00+02:00,3511,code_yellow,2,2.9,1,True
22-10-2025 16:00,52.089770561127374,5.109876746789877,2025-10-23T06:00:00+02:00,3511,code_yellow,2,2.9,1,False
22-10-2025 16:00,52.089770561127374,5.109876746789877,2025-10-23T12:00:00+02:00,3511,code_yellow,2,2.9,1,False
22-10-2025 22:00,52.089770561127374,5.109876746789877,2025-10-23T00:00:00+02:00,3511,code_yellow,4,5.7,1,True
22-10-2025 22:00,52.089770561127374,5.109876746789877,2025-10-23T06:00:00+02:00,3511,code_yellow,4,5.7,1,True
22-10-2025 22:00,52.089770561127374,5.109876746789877,2025-10-23T12:00:00+02:00,3511,code_yellow,4,5.7,1,False
22-10-2025 22:00,52.089770561127374,5.109876746789877,2025-10-23T18:00:00+02:00,3511,code_yellow,4,5.7,1,False
23-10-2025 04:00,52.089770561127374,5.109876746789877,2025-10-23T06:00:00+02:00,3511,code_yellow,4,6.8,1,True
23-10-2025 04:00,52.089770561127374,5.109876746789877,2025-10-23T12:00:00+02:00,3511,code_yellow,4,6.8,1,True
23-10-2025 04:00,52.089770561127374,5.109876746789877,2025-10-23T18:00:00+02:00,3511,code_yellow,4,6.8,1,False
23-10-2025 04:00,52.089770561127374,5.109876746789877,2025-10-24T00:00:00+02:00,3511,code_yellow,4,6.8,1,False
23-10-2025 10:00,52.089770561127374,5.109876746789877,2025-10-23T12:00:00+02:00,3511,code_yellow,4,6.1,1,True
23-10-2025 10:00,52.089770561127374,5.109876746789877,2025-10-23T18:00:00+02:00,3511,code_yellow,4,6.1,1,True
23-10-2025 10:00,52.089770561127374,5.109876746789877,2025-10-24T00:00:00+02:00,3511,code_yellow,4,6.1,1,False
23-10-2025 10:00,52.089770561127374,5.109876746789877,2025-10-24T06:00:00+02:00,3511,code_yellow,4,6.1,1,False
23-10-2025 16:00,52.089770561127374,5.109876746789877,2025-10-23T18:00:00+02:00,3511,code_yellow,5,9.5,1,True
23-10-2025 16:00,52.089770561127374,5.109876746789877,2025-10-24T00:00:00+02:00,3511,code_yellow,5,9.5,1,True
23-10-2025 16:00,52.089770561127374,5.109876746789877,2025-10-24T06:00:00+02:00,3511,code_yellow,5,9.5,1,False
23-10-2025 16:00,52.089770561127374,5.109876746789877,2025-10-24T12:00:00+02:00,3511,code_yellow,5,9.5,1,False
23-10-2025 22:00,52.089770561127374,5.109876746789877,2025-10-24T00:00:00+02:00,3511,code_yellow,5,9.3,1,True
23-10-2025 22:00,52.089770561127374,5.109876746789877,2025-10-24T06:00:00+02:00,3511,code_yellow,5,9.3,1,True
23-10-2025 22:00,52.089770561127374,5.109876746789877,2025-10-24T12:00:00+02:00,3511,code_yellow,5,9.3,1,False
23-10-2025 22:00,52.089770561127374,5.109876746789877,2025-10-24T18:00:00+02:00,3511,code_yellow,5,9.3,1,False
24-10-2025 04:00,52.089770561127374,5.109876746789877,2025-10-24T06:00:00+02:00,3511,code_yellow,5,8.6,1,True
24-10-2025 04:00,52.089770561127374,5.109876746789877,2025-10-24T12:00:00+02:00,3511,code_yellow,5,8.6,1,True
24-10-2025 04:00,52.089770561127374,5.109876746789877,2025-10-24T18:00:00+02:00,3511,code_yellow,5,8.6,1,False
24-10-2025 04:00,52.089770561127374,5.109876746789877,2025-10-25T00:00:00+02:00,3511,code_yellow,5,8.6,1,False
24-10-2025 10:00,52.089770561127374,5.109876746789877,2025-10-24T12:00:00+02:00,3511,code_yellow,4,7.3,1,True
24-10-2025 10:00,52.089770561127374,5.109876746789877,2025-10-24T18:00:00+02:00,3511,code_yellow,4,7.3,1,True
24-10-2025 10:00,52.089770561127374,5.109876746789877,2025-10-25T00:00:00+02:00,3511,code_yellow,4,7.3,1,False
24-10-2025 10:00,52.089770561127374,5.109876746789877,2025-10-25T06:00:00+02:00,3511,code_yellow,4,7.3,1,False
24-10-2025 16:00,52.089770561127374,5.109876746789877,2025-10-24T18:00:00+02:00,3511,code_yellow,4,7.0,1,True
24-10-2025 16:00,52.089770561127374,5.109876746789877,2025-10-25T00:00:00+02:00,3511,code_yellow,4,7.0,1,True
24-10-2025 16:00,52.089770561127374,5.109876746789877,2025-10-25T06:00:00+02:00,3511,code_yellow,4,7.0,1,False
24-10-2025 16:00,52.089770561127374,5.109876746789877,2025-10-25T12:00:00+02:00,3511,code_yellow,4,7.0,1,False
24-10-2025 22:00,52.089770561127374,5.109876746789877,2025-10-25T00:00:00+02:00,3511,code_yellow,4,7.7,1,True
24-10-2025 22:00,52.089770561127374,5.109876746789877,2025-10-25T06:00:00+02:00,3511,code_yellow,4,7.7,1,True
24-10-2025 22:00,52.089770561127374,5.109876746789877,2025-10-25T12:00:00+02:00,3511,code_yellow,4,7.7,1,False
24-10-2025 22:00,52.089770561127374,5.109876746789877,2025-10-25T18:00:00+02:00,3511,code_yellow,4,7.7,1,False
25-10-2025 04:00,52.089770561127374,5.109876746789877,2025-10-25T06:00:00+02:00,3511,code_yellow,4,6.1,1,True
25-10-2025 04:00,52.089770561127374,5.109876746789877,2025-10-25T12:00:00+02:00,3511,code_yellow,4,6.1,1,True
25-10-2025 04:00,52.089770561127374,5.109876746789877,2025-10-25T18:00:00+02:00,3511,code_yellow,4,6.1,1,False
25-10-2025 04:00,52.089770561127374,5.109876746789877,2025-10-26T00:00:00+02:00,3511,code_yellow,4,6.1,1,False
25-10-2025 10:00,52.089770561127374,5.109876746789877,2025-10-25T12:00:00+02:00,3511,code_yellow,4,6.4,1,True
25-10-2025 10:00,52.089770561127374,5.109876746789877,2025-10-25T18:00:00+02:00,3511,code_yellow,4,6.4,1,True
25-10-2025 10:00,52.089770561127374,5.109876746789877,2025-10-26T00:00:00+02:00,3511,code_yellow,4,6.4,1,False
25-10-2025 10:00,52.089770561127374,5.109876746789877,2025-10-26T06:00:00+02:00,3511,code_yellow,4,6.4,1,False
25-10-2025 16:00,52.089770561127374,5.109876746789877,2025-10-25T18:00:00+02:00,3511,code_yellow,3,5.1,1,True
25-10-2025 16:00,52.089770561127374,5.109876746789877,2025-10-26T00:00:00+02:00,3511,code_yellow,3,5.1,1,True
25-10-2025 16:00,52.089770561127374,5.109876746789877,2025-10-26T06:00:00+02:00,3511,code_yellow,3,5.1,1,False
25-10-2025 16:00,52.089770561127374,5.109876746789877,2025-10-26T12:00:00+02:00,3511,code_yellow,3,5.1,1,False
25-10-2025 22:00,52.089770561127374,5.109876746789877,2025-10-26T00:00:00+02:00,3511,code_yellow,4,6.5,1,True
25-10-2025 22:00,52.089770561127374,5.109876746789877,2025-10-26T06:00:00+02:00,3511,code_yellow,4,6.5,1,True
25-10-2025 22:00,52.089770561127374,5.109876746789877,2025-10-26T12:00:00+02:00,3511,code_yellow,4,6.5,1,False
25-10-2025 22:00,52.089770561127374,5.109876746789877,2025-10-26T18:00:00+02:00,3511,code_yellow,4,6.5,1,False
26-10-2025 04:00,52.089770561127374,5.109876746789877,2025-10-26T05:00:00+01:00,3511,code_yellow,5,8.1,1,True
26-10-2025 04:00,52.089770561127374,5.109876746789877,2025-10-26T11:00:00+01:00,3511,code_yellow,5,8.1,1,True
26-10-2025 04:00,52.089770561127374,5.109876746789877,2025-10-26T17:00:00+01:00,3511,code_yellow,5,8.1,1,False
26-10-2025 04:00,52.089770561127374,5.109876746789877,2025-10-26T23:00:00+01:00,3511,code_yellow,5,8.1,1,False
26-10-2025 10:00,52.089770561127374,5.109876746789877,2025-10-26T11:00:00+01:00,3511,code_yellow,4,7.7,1,True
26-10-2025 10:00,52.089770561127374,5.109876746789877,2025-10-26T17:00:00+01:00,3511,code_yellow,4,7.7,1,True
26-10-2025 10:00,52.089770561127374,5.109876746789877,2025-10-26T23:00:00+01:00,3511,code_yellow,4,7.7,1,False
26-10-2025 10:00,52.089770561127374,5.109876746789877,2025-10-27T05:00:00+01:00,3511,code_yellow,4,7.7,1,False
26-10-2025 16:00,52.089770561127374,5.109876746789877,2025-10-26T17:00:00+01:00,3511,code_yellow,3,5.4,1,True
26-10-2025 16:00,52.089770561127374,5.109876746789877,2025-10-26T23:00:00+01:00,3511,code_yellow,3,5.4,1,True
26-10-2025 16:00,52.089770561127374,5.109876746789877,2025-10-27T05:00:00+01:00,3511,code_yellow,3,5.4,1,False
26-10-2025 16:00,52.089770561127374,5.109876746789877,2025-10-27T11:00:00+01:00,3511,code_yellow,3,5.4,1,False
26-10-2025 22:00,52.089770561127374,5.109876746789877,2025-10-26T23:00:00+01:00,3511,code_yellow,4,6.8,1,True
26-10-2025 22:00,52.089770561127374,5.109876746789877,2025-10-27T05:00:00+01:00,3511,code_yellow,4,6.8,1,True
26-10-2025 22:00,52.089770561127374,5.109876746789877,2025-10-27T11:00:00+01:00,3511,code_yellow,4,6.8,1,False
26-10-2025 22:00,52.089770561127374,5.109876746789877,2025-10-27T17:00:00+01:00,3511,code_red,4,6.8,1,False
27-10-2025 04:00,52.089770561127374,5.109876746789877,2025-10-27T05:00:00+01:00,3511,code_yellow,4,7.4,1,True
27-10-2025 04:00,52.089770561127374,5.109876746789877,2025-10-27T11:00:00+01:00,3511,code_yellow,4,7.4,1,True
27-10-2025 04:00,52.089770561127374,5.109876746789877,2025-10-27T17:00:00+01:00,3511,code_yellow,4,7.4,1,False
27-10-2025 04:00,52.089770561127374,5.109876746789877,2025-10-27T23:00:00+01:00,3511,code_yellow,4,7.4,1,False
27-10-2025 10:00,52.089770561127374,5.109876746789877,2025-10-27T11:00:00+01:00,3511,code_yellow,4,6.4,1,True
27-10-2025 10:00,52.089770561127374,5.109876746789877,2025-10-27T17:00:00+01:00,3511,code_yellow,4,6.4,1,True
27-10-2025 10:00,52.089770561127374,5.109876746789877,2025-10-27T23:00:00+01:00,3511,code_yellow,4,6.4,1,False
27-10-2025 10:00,52.089770561127374,5.109876746789877,2025-10-28T05:00:00+01:00,3511,code_yellow,4,6.4,1,False
27-10-2025 16:00,52.089770561127374,5.109876746789877,2025-10-27T17:00:00+01:00,3511,code_yellow,3,3.7,1,True
27-10-2025 16:00,52.089770561127374,5.109876746789877,2025-10-27T23:00:00+01:00,3511,code_yellow,3,3.7,1,True
27-10-2025 16:00,52.089770561127374,5.109876746789877,2025-10-28T05:00:00+01:00,3511,code_yellow,3,3.7,1,False
27-10-2025 16:00,52.089770561127374,5.109876746789877,2025-10-28T11:00:00+01:00,3511,code_yellow,3,3.7,1,False
27-10-2025 22:00,52.089770561127374,5.109876746789877,2025-10-27T23:00:00+01:00,3511,code_yellow,3,4.5,1,True
27-10-2025 22:00,52.089770561127374,5.109876746789877,2025-10-28T05:00:00+01:00,3511,code_yellow,3,4.5,1,True
27-10-2025 22:00,52.089770561127374,5.109876746789877,2025-10-28T11:00:00+01:00,3511,code_yellow,3,4.5,1,False
27-10-2025 22:00,52.089770561127374,5.109876746789877,2025-10-28T17:00:00+01:00,3511,code_yellow,3,4.5,1,False
28-10-2025 04:00,52.089770561127374,5.109876746789877,2025-10-28T05:00:00+01:00,3511,code_yellow,4,7.0,1,True
28-10-2025 04:00,52.089770561127374,5.109876746789877,2025-10-28T11:00:00+01:00,3511,code_yellow,4,7.0,1,True
28-10-2025 04:00,52.089770561127374,5.109876746789877,2025-10-28T17:00:00+01:00,3511,code_yellow,4,7.0,1,False
28-10-2025 04:00,52.089770561127374,5.109876746789877,2025-10-28T23:00:00+01:00,3511,code_yellow,4,7.0,1,False
28-10-2025 10:00,52.089770561127374,5.109876746789877,2025-10-28T11:00:00+01:00,3511,code_yellow,4,7.3,1,True
28-10-2025 10:00,52.089770561127374,5.109876746789877,2025-10-28T17:00:00+01:00,3511,code_yellow,4,7.3,1,True
28-10-2025 10:00,52.089770561127374,5.109876746789877,2025-10-28T23:00:00+01:00,3511,code_yellow,4,7.3,1,False
28-10-2025 10:00,52.089770561127374,5.109876746789877,2025-10-29T05:00:00+01:00,3511,code_yellow,4,7.3,1,False
28-10-2025 16:00,52.089770561127374,5.109876746789877,2025-10-28T17:00:00+01:00,3511,code_yellow,3,3.6,1,True
28-10-2025 16:00,52.089770561127374,5.109876746789877,2025-10-28T23:00:00+01:00,3511,code_yellow,3,3.6,1,True
28-10-2025 16:00,52.089770561127374,5.109876746789877,2025-10-29T05:00:00+01:00,3511,code_yellow,3,3.6,1,False
28-10-2025 16:00,52.089770561127374,5.109876746789877,2025-10-29T11:00:00+01:00,3511,code_yellow,3,3.6,1,False
28-10-2025 22:00,52.089770561127374,5.109876746789877,2025-10-28T23:00:00+01:00,3511,code_yellow,3,4.3,1,True
28-10-2025 22:00,52.089770561127374,5.109876746789877,2025-10-29T05:00:00+01:00,3511,code_yellow,3,4.3,1,True
28-10-2025 22:00,52.089770561127374,5.109876746789877,2025-10-29T11:00:00+01:00,3511,code_yellow,3,4.3,1,False
28-10-2025 22:00,52.089770561127374,5.109876746789877,2025-10-29T17:00:00+01:00,3511,code_yellow,3,4.3,1,False
29-10-2025 04:00,52.089770561127374,5.109876746789877,2025-10-29T05:00:00+01:00,3511,code_yellow,3,5.4,1,True
29-10-2025 04:00,52.089770561127374,5.109876746789877,2025-10-29T11:00:00+01:00,3511,code_yellow,3,5.4,1,True
29-10-2025 04:00,52.089770561127374,5.109876746789877,2025-10-29T17:00:00+01:00,3511,code_yellow,3,5.4,1,False
29-10-2025 04:00,52.089770561127374,5.109876746789877,2025-10-29T23:00:00+01:00,3511,code_yellow,3,5.4,1,False
29-10-2025 10:00,52.089770561127374,5.109876746789877,2025-10-29T11:00:00+01:00,3511,code_yellow,3,5.3,1,True
29-10-2025 10:00,52.089770561127374,5.109876746789877,2025-10-29T17:00:00+01:00,3511,code_yellow,3,5.3,1,True
29-10-2025 10:00,52.089770561127374,5.109876746789877,2025-10-29T23:00:00+01:00,3511,code_yellow,3,5.3,1,False
29-10-2025 10:00,52.089770561127374,5.109876746789877,2025-10-30T05:00:00+01:00,3511,code_yellow,3,5.3,1,False
29-10-2025 16:00,52.089770561127374,5.109876746789877,2025-10-29T17:00:00+01:00,3511,code_yellow,3,3.7,1,True
29-10-2025 16:00,52.089770561127374,5.109876746789877,2025-10-29T23:00:00+01:00,3511,code_yellow,3,3.7,1,True
29-10-2025 16:00,52.089770561127374,5.109876746789877,2025-10-30T05:00:00+01:00,3511,code_yellow,3,3.7,1,False
29-10-2025 16:00,52.089770561127374,5.109876746789877,2025-10-30T11:00:00+01:00,3511,code_yellow,3,3.7,1,False
29-10-2025 22:00,52.089770561127374,5.109876746789877,2025-10-29T23:00:00+01:00,3511,code_yellow,4,5.7,1,True
29-10-2025 22:00,52.089770561127374,5.109876746789877,2025-10-30T05:00:00+01:00,3511,code_yellow,4,5.7,1,True
29-10-2025 22:00,52.089770561127374,5.109876746789877,2025-10-30T11:00:00+01:00,3511,code_yellow,4,5.7,1,False
29-10-2025 22:00,52.089770561127374,5.109876746789877,2025-10-30T17:00:00+01:00,3511,code_red,4,5.7,1,False
30-10-2025 04:00,52.089770561127374,5.109876746789877,2025-10-30T05:00:00+01:00,3511,code_yellow,3,4.7,1,True
30-10-2025 04:00,52.089770561127374,5.109876746789877,2025-10-30T11:00:00+01:00,3511,code_yellow,3,4.7,1,True
30-10-2025 04:00,52.089770561127374,5.109876746789877,2025-10-30T17:00:00+01:00,3511,code_red,3,4.7,1,False
30-10-2025 04:00,52.089770561127374,5.109876746789877,2025-10-30T23:00:00+01:00,3511,code_yellow,3,4.7,1,False
30-10-2025 10:00,52.089770561127374,5.109876746789877,2025-10-30T11:00:00+01:00,3511,code_yellow,3,4.7,1,True
30-10-2025 10:00,52.089770561127374,5.109876746789877,2025-10-30T17:00:00+01:00,3511,code_red,3,4.7,1,True
30-10-2025 10:00,52.089770561127374,5.109876746789877,2025-10-30T23:00:00+01:00,3511,code_yellow,3,4.7,1,False
30-10-2025 10:00,52.089770561127374,5.109876746789877,2025-10-31T05:00:00+01:00,3511,code_yellow,3,4.7,1,False
30-10-2025 16:00,52.089770561127374,5.109876746789877,2025-10-30T17:00:00+01:00,3511,code_red,2,3.1,1,True
30-10-2025 16:00,52.089770561127374,5.109876746789877,2025-10-30T23:00:00+01:00,3511,code_yellow,2,3.1,1,True
30-10-2025 16:00,52.089770561127374,5.109876746789877,2025-10-31T05:00:00+01:00,3511,code_yellow,2,3.1,1,False
30-10-2025 16:00,52.089770561127374,5.109876746789877,2025-10-31T11:00:00+01:00,3511,code_yellow,2,3.1,1,False
30-10-2025 22:00,52.089770561127374,5.109876746789877,2025-10-30T23:00:00+01:00,3511,code_yellow,3,4.2,1,True
30-10-2025 22:00,52.089770561127374,5.109876746789877,2025-10-31T05:00:00+01:00,3511,code_yellow,3,4.2,1,True
30-10-2025 22:00,52.089770561127374,5.109876746789877,2025-10-31T11:00:00+01:00,3511,code_yellow,3,4.2,1,False
30-10-2025 22:00,52.089770561127374,5.109876746789877,2025-10-31T17:00:00+01:00,3511,code_yellow,3,4.2,1,False
31-10-2025 04:00,52.089770561127374,5.109876746789877,2025-10-31T05:00:00+01:00,3511,code_yellow,3,4.6,1,True
31-10-2025 04:00,52.089770561127374,5.109876746789877,2025-10-31T11:00:00+01:00,3511,code_yellow,3,4.6,1,True
31-10-2025 04:00,52.089770561127374,5.109876746789877,2025-10-31T17:00:00+01:00,3511,code_yellow,3,4.6,1,False
31-10-2025 04:00,52.089770561127374,5.109876746789877,2025-10-31T23:00:00+01:00,3511,code_yellow,3,4.6,1,False
31-10-2025 10:00,52.089770561127374,5.109876746789877,2025-10-31T11:00:00+01:00,3511,code_yellow,3,4.5,1,True
31-10-2025 10:00,52.089770561127374,5.109876746789877,2025-10-31T17:00:00+01:00,3511,code_yellow,3,4.5,1,True
31-10-2025 10:00,52.089770561127374,5.109876746789877,2025-10-31T23:00:00+01:00,3511,code_yellow,3,4.5,1,False
31-10-2025 10:00,52.089770561127374,5.109876746789877,2025-11-01T05:00:00+01:00,3511,code_yellow,3,4.5,1,False
31-10-2025 16:00,52.089770561127374,5.109876746789877,2025-10-31T17:00:00+01:00,3511,code_yellow,3,4.1,1,True
31-10-2025 16:00,52.089770561127374,5.109876746789877,2025-10-31T23:00:00+01:00,3511,code_yellow,3,4.1,1,True
31-10-2025 16:00,52.089770561127374,5.109876746789877,2025-11-01T05:00:00+01:00,3511,code_yellow,3,4.1,1,False
31-10-2025 16:00,52.089770561127374,5.109876746789877,2025-11-01T11:00:00+01:00,3511,code_yellow,3,4.1,1,False
31-10-2025 22:00,52.089770561127374,5.109876746789877,2025-10-31T23:00:00+01:00,3511,code_yellow,3,4.5,1,True
31-10-2025 22:00,52.089770561127374,5.109876746789877,2025-11-01T05:00:00+01:00,3511,code_yellow,3,4.5,1,True
31-10-2025 22:00,52.089770561127374,5.109876746789877,2025-11-01T11:00:00+01:00,3511,code_yellow,3,4.5,1,False
31-10-2025 22:00,52.089770561127374,5.109876746789877,2025-11-01T17:00:00+01:00,3511,code_yellow,3,4.5,1,False
01-11-2025 04:00,52.089770561127374,5.109876746789877,2025-11-01T05:00:00+01:00,3511,code_yellow,3,4.9,1,True
01-11-2025 04:00,52.089770561127374,5.109876746789877,2025-11-01T11:00:00+01:00,3511,code_yellow,3,4.9,1,True
01-11-2025 04:00,52.089770561127374,5.109876746789877,2025-11-01T17:00:00+01:00,3511,code_yellow,3,4.9,1,False
01-11-2025 04:00,52.089770561127374,5.109876746789877,2025-11-01T23:00:00+01:00,3511,code_yellow,3,4.9,1,False
01-11-2025 10:00,52.089770561127374,5.109876746789877,2025-11-01T11:00:00+01:00,3511,code_yellow,3,4.9,1,True
01-11-2025 10:00,52.089770561127374,5.109876746789877,2025-11-01T17:00:00+01:00,3511,code_yellow,3,4.9,1,True
01-11-2025 10:00,52.089770561127374,5.109876746789877,2025-11-01T23:00:00+01:00,3511,code_yellow,3,4.9,1,False
01-11-2025 10:00,52.089770561127374,5.109876746789877,2025-11-02T05:00:00+01:00,3511,code_yellow,3,4.9,1,False
01-11-2025 16:00,52.089770561127374,5.109876746789877,2025-11-01T17:00:00+01:00,3511,code_yellow,3,4.4,1,True
01-11-2025 16:00,52.089770561127374,5.109876746789877,2025-11-01T23:00:00+01:00,3511,code_yellow,3,4.4,1,True
01-11-2025 16:00,52.089770561127374,5.109876746789877,2025-11-02T05:00:00+01:00,3511,code_yellow,3,4.4,1,False
01-11-2025 16:00,52.089770561127374,5.109876746789877,2025-11-02T11:00:00+01:00,3511,code_yellow,3,4.4,1,False
01-11-2025 22:00,52.089770561127374,5.109876746789877,2025-11-01T23:00:00+01:00,3511,code_yellow,3,5.3,1,True
01-11-2025 22:00,52.089770561127374,5.109876746789877,2025-11-02T05:00:00+01:00,3511,code_yellow,3,5.3,1,True
01-11-2025 22:00,52.089770561127374,5.109876746789877,2025-11-02T11:00:00+01:00,3511,code_yellow,3,5.3,1,False
01-11-2025 22:00,52.089770561127374,5.109876746789877,2025-11-02T17:00:00+01:00,3511,code_yellow,3,5.3,1,False
02-11-2025 04:00,52.089770561127374,5.109876746789877,2025-11-02T05:00:00+01:00,3511,code_yellow,3,4.8,1,True
02-11-2025 04:00,52.089770561127374,5.109876746789877,2025-11-02T11:00:00+01:00,3511,code_yellow,3,4.8,1,True
02-11-2025 04:00,52.089770561127374,5.109876746789877,2025-11-02T17:00:00+01:00,3511,code_yellow,3,4.8,1,False
02-11-2025 04:00,52.089770561127374,5.109876746789877,2025-11-02T23:00:00+01:00,3511,code_yellow,3,4.8,1,False
02-11-2025 10:00,52.089770561127374,5.109876746789877,2025-11-02T11:00:00+01:00,3511,code_yellow,4,5.7,1,True
02-11-2025 10:00,52.089770561127374,5.109876746789877,2025-11-02T17:00:00+01:00,3511,code_yellow,4,5.7,1,True
02-11-2025 10:00,52.089770561127374,5.109876746789877,2025-11-02T23:00:00+01:00,3511,code_yellow,4,5.7,1,False
02-11-2025 10:00,52.089770561127374,5.109876746789877,2025-11-03T05:00:00+01:00,3511,code_yellow,4,5.7,1,False
02-11-2025 16:00,52.089770561127374,5.109876746789877,2025-11-02T17:00:00+01:00,3511,code_yellow,3,3.5,1,True
02-11-2025 16:00,52.089770561127374,5.109876746789877,2025-11-02T23:00:00+01:00,3511,code_yellow,3,3.5,1,True
02-11-2025 16:00,52.089770561127374,5.109876746789877,2025-11-03T05:00:00+01:00,3511,code_yellow,3,3.5,1,False
02-11-2025 16:00,52.089770561127374,5.109876746789877,2025-11-03T11:00:00+01:00,3511,code_yellow,3,3.5,1,False
02-11-2025 22:00,52.089770561127374,5.109876746789877,2025-11-02T23:00:00+01:00,3511,code_yellow,3,3.9,1,True
02-11-2025 22:00,52.089770561127374,5.109876746789877,2025-11-03T05:00:00+01:00,3511,code_yellow,3,3.9,1,True
02-11-2025 22:00,52.089770561127374,5.109876746789877,2025-11-03T11:00:00+01:00,3511,code_yellow,3,3.9,1,False
02-11-2025 22:00,52.089770561127374,5.109876746789877,2025-11-03T17:00:00+01:00,3511,code_yellow,3,3.9,1,False
03-11-2025 04:00,52.089770561127374,5.109876746789877,2025-11-03T05:00:00+01:00,3511,code_yellow,3,4.6,1,True
03-11-2025 04:00,52.089770561127374,5.109876746789877,2025-11-03T11:00:00+01:00,3511,code_yellow,3,4.6,1,True
03-11-2025 04:00,52.089770561127374,5.109876746789877,2025-11-03T17:00:00+01:00,3511,code_yellow,3,4.6,1,False
03-11-2025 04:00,52.089770561127374,5.109876746789877,2025-11-03T23:00:00+01:00,3511,code_yellow,3,4.6,1,False
03-11-2025 10:00,52.089770561127374,5.109876746789877,2025-11-03T11:00:00+01:00,3511,code_yellow,4,6.5,1,True
03-11-2025 10:00,52.089770561127374,5.109876746789877,2025-11-03T17:00:00+01:00,3511,code_yellow,4,6.5,1,True
03-11-2025 10:00,52.089770561127374,5.109876746789877,2025-11-03T23:00:00+01:00,3511,code_yellow,4,6.5,1,False
03-11-2025 10:00,52.089770561127374,5.109876746789877,2025-11-04T05:00:00+01:00,3511,code_yellow,4,6.5,1,False
03-11-2025 16:00,52.089770561127374,5.109876746789877,2025-11-03T17:00:00+01:00,3511,code_yellow,4,6.1,1,True
03-11-2025 16:00,52.089770561127374,5.109876746789877,2025-11-03T23:00:00+01:00,3511,code_yellow,4,6.1,1,True
03-11-2025 16:00,52.089770561127374,5.109876746789877,2025-11-04T05:00:00+01:00,3511,code_yellow,4,6.1,1,False
03-11-2025 16:00,52.089770561127374,5.109876746789877,2025-11-04T11:00:00+01:00,3511,code_yellow,4,6.1,1,False
03-11-2025 22:00,52.089770561127374,5.109876746789877,2025-11-03T23:00:00+01:00,3511,code_yellow,3,5.2,1,True
03-11-2025 22:00,52.089770561127374,5.109876746789877,2025-11-04T05:00:00+01:00,3511,code_yellow,3,5.2,1,True
03-11-2025 22:00,52.089770561127374,5.109876746789877,2025-11-04T11:00:00+01:00,3511,code_yellow,3,5.2,1,False
03-11-2025 22:00,52.089770561127374,5.109876746789877,2025-11-04T17:00:00+01:00,3511,code_yellow,3,5.2,1,False
04-11-2025 04:00,52.089770561127374,5.109876746789877,2025-11-04T05:00:00+01:00,3511,code_yellow,3,4.8,1,True
04-11-2025 04:00,52.089770561127374,5.109876746789877,2025-11-04T11:00:00+01:00,3511,code_yellow,3,4.8,1,True
04-11-2025 04:00,52.089770561127374,5.109876746789877,2025-11-04T17:00:00+01:00,3511,code_yellow,3,4.8,1,False
04-11-2025 04:00,52.089770561127374,5.109876746789877,2025-11-04T23:00:00+01:00,3511,code_yellow,3,4.8,1,False
04-11-2025 10:00,52.089770561127374,5.109876746789877,2025-11-04T11:00:00+01:00,3511,code_yellow,3,5.4,1,True
04-11-2025 10:00,52.089770561127374,5.109876746789877,2025-11-04T17:00:00+01:00,3511,code_yellow,3,5.4,1,True
04-11-2025 10:00,52.089770561127374,5.109876746789877,2025-11-04T23:00:00+01:00,3511,code_yellow,3,5.4,1,False
04-11-2025 10:00,52.089770561127374,5.109876746789877,2025-11-05T05:00:00+01:00,3511,code_yellow,3,5.4,1,False
04-11-2025 16:00,52.089770561127374,5.109876746789877,2025-11-04T17:00:00+01:00,3511,code_yellow,3,5.0,1,True
04-11-2025 16:00,52.089770561127374,5.109876746789877,2025-11-04T23:00:00+01:00,3511,code_yellow,3,5.0,1,True
04-11-2025 16:00,52.089770561127374,5.109876746789877,2025-11-05T05:00:00+01:00,3511,code_yellow,3,5.0,1,False
04-11-2025 16:00,52.089770561127374,5.109876746789877,2025-11-05T11:00:00+01:00,3511,code_yellow,3,5.0,1,False
04-11-2025 22:00,52.089770561127374,5.109876746789877,2025-11-04T23:00:00+01:00,3511,code_yellow,3,4.2,1,True
04-11-2025 22:00,52.089770561127374,5.109876746789877,2025-11-05T05:00:00+01:00,3511,code_yellow,3,4.2,1,True
04-11-2025 22:00,52.089770561127374,5.109876746789877,2025-11-05T11:00:00+01:00,3511,code_yellow,3,4.2,1,False
04-11-2025 22:00,52.089770561127374,5.109876746789877,2025-11-05T17:00:00+01:00,3511,code_yellow,3,4.2,1,False
05-11-2025 04:00,52.089770561127374,5.109876746789877,2025-11-05T05:00:00+01:00,3511,code_yellow,3,4.0,1,True
05-11-2025 04:00,52.089770561127374,5.109876746789877,2025-11-05T11:00:00+01:00,3511,code_yellow,3,4.0,1,True
05-11-2025 04:00,52.089770561127374,5.109876746789877,2025-11-05T17:00:00+01:00,3511,code_yellow,3,4.0,1,False
05-11-2025 04:00,52.089770561127374,5.109876746789877,2025-11-05T23:00:00+01:00,3511,code_red,3,4.0,1,False
05-11-2025 10:00,52.089770561127374,5.109876746789877,2025-11-05T11:00:00+01:00,3511,code_yellow,3,4.6,1,True
05-11-2025 10:00,52.089770561127374,5.109876746789877,2025-11-05T17:00:00+01:00,3511,code_yellow,3,4.6,1,True
05-11-2025 10:00,52.089770561127374,5.109876746789877,2025-11-05T23:00:00+01:00,3511,code_red,3,4.6,1,False
05-11-2025 10:00,52.089770561127374,5.109876746789877,2025-11-06T05:00:00+01:00,3511,code_red,3,4.6,1,False
05-11-2025 16:00,52.089770561127374,5.109876746789877,2025-11-05T17:00:00+01:00,3511,code_yellow,3,4.0,1,True
05-11-2025 16:00,52.089770561127374,5.109876746789877,2025-11-05T23:00:00+01:00,3511,code_yellow,3,4.0,1,True
05-11-2025 16:00,52.089770561127374,5.109876746789877,2025-11-06T05:00:00+01:00,3511,code_yellow,3,4.0,1,False
05-11-2025 16:00,52.089770561127374,5.109876746789877,2025-11-06T11:00:00+01:00,3511,code_red,3,4.0,1,False
05-11-2025 22:00,52.089770561127374,5.109876746789877,2025-11-05T23:00:00+01:00,3511,code_yellow,3,3.6,1,True
05-11-2025 22:00,52.089770561127374,5.109876746789877,2025-11-06T05:00:00+01:00,3511,code_red,3,3.6,1,True
05-11-2025 22:00,52.089770561127374,5.109876746789877,2025-11-06T11:00:00+01:00,3511,code_yellow,3,3.6,1,False
05-11-2025 22:00,52.089770561127374,5.109876746789877,2025-11-06T17:00:00+01:00,3511,code_red,3,3.6,1,False
06-11-2025 04:00,52.089770561127374,5.109876746789877,2025-11-06T05:00:00+01:00,3511,code_red,2,3.3,1,True
06-11-2025 04:00,52.089770561127374,5.109876746789877,2025-11-06T11:00:00+01:00,3511,code_yellow,2,3.3,1,True
06-11-2025 04:00,52.089770561127374,5.109876746789877,2025-11-06T17:00:00+01:00,3511,code_red,2,3.3,1,False
06-11-2025 04:00,52.089770561127374,5.109876746789877,2025-11-06T23:00:00+01:00,3511,code_red,2,3.3,1,False
06-11-2025 10:00,52.089770561127374,5.109876746789877,2025-11-06T11:00:00+01:00,3511,code_yellow,3,3.5,1,True
06-11-2025 10:00,52.089770561127374,5.109876746789877,2025-11-06T17:00:00+01:00,3511,code_red,3,3.5,1,True
06-11-2025 10:00,52.089770561127374,5.109876746789877,2025-11-06T23:00:00+01:00,3511,code_red,3,3.5,1,False
06-11-2025 10:00,52.089770561127374,5.109876746789877,2025-11-07T05:00:00+01:00,3511,code_red,3,3.5,1,False
06-11-2025 16:00,52.089770561127374,5.109876746789877,2025-11-06T17:00:00+01:00,3511,code_red,2,3.1,1,True
06-11-2025 16:00,52.089770561127374,5.109876746789877,2025-11-06T23:00:00+01:00,3511,code_red,2,3.1,1,True
06-11-2025 16:00,52.089770561127374,5.109876746789877,2025-11-07T05:00:00+01:00,3511,code_red,2,3.1,1,False
06-11-2025 16:00,52.089770561127374,5.109876746789877,2025-11-07T11:00:00+01:00,3511,code_red,2,3.1,1,False
06-11-2025 22:00,52.089770561127374,5.109876746789877,2025-11-06T23:00:00+01:00,3511,code_red,2,2.6,1,True
06-11-2025 22:00,52.089770561127374,5.109876746789877,2025-11-07T05:00:00+01:00,3511,code_red,2,2.6,1,True
06-11-2025 22:00,52.089770561127374,5.109876746789877,2025-11-07T11:00:00+01:00,3511,code_red,2,2.6,1,False
06-11-2025 22:00,52.089770561127374,5.109876746789877,2025-11-07T17:00:00+01:00,3511,code_red,2,2.6,1,False
07-11-2025 04:00,52.089770561127374,5.109876746789877,2025-11-07T05:00:00+01:00,3511,code_red,2,2.0,1,True
07-11-2025 04:00,52.089770561127374,5.109876746789877,2025-11-07T11:00:00+01:00,3511,code_red,2,2.0,1,True
07-11-2025 04:00,52.089770561127374,5.109876746789877,2025-11-07T17:00:00+01:00,3511,code_red,2,2.0,1,False
07-11-2025 04:00,52.089770561127374,5.109876746789877,2025-11-07T23:00:00+01:00,3511,code_red,2,2.0,1,False
07-11-2025 10:00,52.089770561127374,5.109876746789877,2025-11-07T11:00:00+01:00,3511,code_red,2,3.1,1,True
07-11-2025 10:00,52.089770561127374,5.109876746789877,2025-11-07T17:00:00+01:00,3511,code_red,2,3.1,1,True
07-11-2025 10:00,52.089770561127374,5.109876746789877,2025-11-07T23:00:00+01:00,3511,code_red,2,3.1,1,False
07-11-2025 10:00,52.089770561127374,5.109876746789877,2025-11-08T05:00:00+01:00,3511,code_red,2,3.1,1,False
07-11-2025 16:00,52.089770561127374,5.109876746789877,2025-11-07T17:00:00+01:00,3511,code_red,2,3.1,2,True
07-11-2025 16:00,52.089770561127374,5.109876746789877,2025-11-07T23:00:00+01:00,3511,code_red,2,3.1,2,True
07-11-2025 16:00,52.089770561127374,5.109876746789877,2025-11-08T05:00:00+01:00,3511,code_red,2,3.1,2,False
07-11-2025 16:00,52.089770561127374,5.109876746789877,2025-11-08T11:00:00+01:00,3511,code_red,2,3.1,2,False
07-11-2025 22:00,52.089770561127374,5.109876746789877,2025-11-07T23:00:00+01:00,3511,code_red,2,1.9,2,True
07-11-2025 22:00,52.089770561127374,5.109876746789877,2025-11-08T05:00:00+01:00,3511,code_red,2,1.9,2,True
07-11-2025 22:00,52.089770561127374,5.109876746789877,2025-11-08T11:00:00+01:00,3511,code_red,2,1.9,2,False
07-11-2025 22:00,52.089770561127374,5.109876746789877,2025-11-08T17:00:00+01:00,3511,code_red,2,1.9,2,False
08-11-2025 04:00,52.089770561127374,5.109876746789877,2025-11-08T05:00:00+01:00,3511,code_red,2,1.7,2,True
08-11-2025 04:00,52.089770561127374,5.109876746789877,2025-11-08T11:00:00+01:00,3511,code_red,2,1.7,2,True
08-11-2025 04:00,52.089770561127374,5.109876746789877,2025-11-08T17:00:00+01:00,3511,code_red,2,1.7,2,False
08-11-2025 04:00,52.089770561127374,5.109876746789877,2025-11-08T23:00:00+01:00,3511,code_red,2,1.7,2,False
08-11-2025 10:00,52.089770561127374,5.109876746789877,2025-11-08T11:00:00+01:00,3511,code_red,2,1.9,2,True
08-11-2025 10:00,52.089770561127374,5.109876746789877,2025-11-08T17:00:00+01:00,3511,code_red,2,1.9,2,True
08-11-2025 10:00,52.089770561127374,5.109876746789877,2025-11-08T23:00:00+01:00,3511,code_red,2,1.9,2,False
08-11-2025 10:00,52.089770561127374,5.109876746789877,2025-11-09T05:00:00+01:00,3511,code_red,2,1.9,2,False
08-11-2025 16:00,52.089770561127374,5.109876746789877,2025-11-08T17:00:00+01:00,3511,code_red,2,2.0,1,True
08-11-2025 16:00,52.089770561127374,5.109876746789877,2025-11-08T23:00:00+01:00,3511,code_red,2,2.0,1,True
08-11-2025 16:00,52.089770561127374,5.109876746789877,2025-11-09T05:00:00+01:00,3511,code_red,2,2.0,1,False
08-11-2025 16:00,52.089770561127374,5.109876746789877,2025-11-09T11:00:00+01:00,3511,code_red,2,2.0,1,False
08-11-2025 22:00,52.089770561127374,5.109876746789877,2025-11-08T23:00:00+01:00,3511,code_red,2,3.1,1,True
08-11-2025 22:00,52.089770561127374,5.109876746789877,2025-11-09T05:00:00+01:00,3511,code_red,2,3.1,1,True
08-11-2025 22:00,52.089770561127374,5.109876746789877,2025-11-09T11:00:00+01:00,3511,code_red,2,3.1,1,False
08-11-2025 22:00,52.089770561127374,5.109876746789877,2025-11-09T17:00:00+01:00,3511,code_red,2,3.1,1,False
09-11-2025 04:00,52.089770561127374,5.109876746789877,2025-11-09T05:00:00+01:00,3511,code_red,2,2.4,1,True
09-11-2025 04:00,52.089770561127374,5.109876746789877,2025-11-09T11:00:00+01:00,3511,code_red,2,2.4,1,True
09-11-2025 04:00,52.089770561127374,5.109876746789877,2025-11-09T17:00:00+01:00,3511,code_red,2,2.4,1,False
09-11-2025 04:00,52.089770561127374,5.109876746789877,2025-11-09T23:00:00+01:00,3511,code_red,2,2.4,1,False
09-11-2025 10:00,52.089770561127374,5.109876746789877,2025-11-09T11:00:00+01:00,3511,code_red,2,3.1,1,True
09-11-2025 10:00,52.089770561127374,5.109876746789877,2025-11-09T17:00:00+01:00,3511,code_red,2,3.1,1,True
09-11-2025 10:00,52.089770561127374,5.109876746789877,2025-11-09T23:00:00+01:00,3511,code_red,2,3.1,1,False
09-11-2025 10:00,52.089770561127374,5.109876746789877,2025-11-10T05:00:00+01:00,3511,code_yellow,2,3.1,1,False
09-11-2025 16:00,52.089770561127374,5.109876746789877,2025-11-09T17:00:00+01:00,3511,code_red,2,2.3,1,True
09-11-2025 16:00,52.089770561127374,5.109876746789877,2025-11-09T23:00:00+01:00,3511,code_yellow,2,2.3,1,True
09-11-2025 16:00,52.089770561127374,5.109876746789877,2025-11-10T05:00:00+01:00,3511,code_yellow,2,2.3,1,False
09-11-2025 16:00,52.089770561127374,5.109876746789877,2025-11-10T11:00:00+01:00,3511,code_yellow,2,2.3,1,False
09-11-2025 22:00,52.089770561127374,5.109876746789877,2025-11-09T23:00:00+01:00,3511,code_yellow,3,3.4,1,True
09-11-2025 22:00,52.089770561127374,5.109876746789877,2025-11-10T05:00:00+01:00,3511,code_yellow,3,3.4,1,True
09-11-2025 22:00,52.089770561127374,5.109876746789877,2025-11-10T11:00:00+01:00,3511,code_yellow,3,3.4,1,False
09-11-2025 22:00,52.089770561127374,5.109876746789877,2025-11-10T17:00:00+01:00,3511,code_yellow,3,3.4,1,False
10-11-2025 04:00,52.089770561127374,5.109876746789877,2025-11-10T05:00:00+01:00,3511,code_yellow,3,4.5,1,True
10-11-2025 04:00,52.089770561127374,5.109876746789877,2025-11-10T11:00:00+01:00,3511,code_yellow,3,4.5,1,True
10-11-2025 04:00,52.089770561127374,5.109876746789877,2025-11-10T17:00:00+01:00,3511,code_yellow,3,4.5,1,False
10-11-2025 04:00,52.089770561127374,5.109876746789877,2025-11-10T23:00:00+01:00,3511,code_yellow,3,4.5,1,False
10-11-2025 10:00,52.089770561127374,5.109876746789877,2025-11-10T11:00:00+01:00,3511,code_yellow,3,4.8,1,True
10-11-2025 10:00,52.089770561127374,5.109876746789877,2025-11-10T17:00:00+01:00,3511,code_yellow,3,4.8,1,True
10-11-2025 10:00,52.089770561127374,5.109876746789877,2025-11-10T23:00:00+01:00,3511,code_yellow,3,4.8,1,False
10-11-2025 10:00,52.089770561127374,5.109876746789877,2025-11-11T05:00:00+01:00,3511,code_yellow,3,4.8,1,False
10-11-2025 16:00,52.089770561127374,5.109876746789877,2025-11-10T17:00:00+01:00,3511,code_yellow,3,5.2,1,True
10-11-2025 16:00,52.089770561127374,5.109876746789877,2025-11-10T23:00:00+01:00,3511,code_yellow,3,5.2,1,True
10-11-2025 16:00,52.089770561127374,5.109876746789877,2025-11-11T05:00:00+01:00,3511,code_yellow,3,5.2,1,False
10-11-2025 16:00,52.089770561127374,5.109876746789877,2025-11-11T11:00:00+01:00,3511,code_yellow,3,5.2,1,False
10-11-2025 22:00,52.089770561127374,5.109876746789877,2025-11-10T23:00:00+01:00,3511,code_yellow,3,5.3,1,True
10-11-2025 22:00,52.089770561127374,5.109876746789877,2025-11-11T05:00:00+01:00,3511,code_yellow,3,5.3,1,True
10-11-2025 22:00,52.089770561127374,5.109876746789877,2025-11-11T11:00:00+01:00,3511,code_yellow,3,5.3,1,False
10-11-2025 22:00,52.089770561127374,5.109876746789877,2025-11-11T17:00:00+01:00,3511,code_yellow,3,5.3,1,False
11-11-2025 04:00,52.089770561127374,5.109876746789877,2025-11-11T05:00:00+01:00,3511,code_yellow,3,4.9,1,True
11-11-2025 04:00,52.089770561127374,5.109876746789877,2025-11-11T11:00:00+01:00,3511,code_yellow,3,4.9,1,True
11-11-2025 04:00,52.089770561127374,5.109876746789877,2025-11-11T17:00:00+01:00,3511,code_yellow,3,4.9,1,False
11-11-2025 04:00,52.089770561127374,5.109876746789877,2025-11-11T23:00:00+01:00,3511,code_yellow,3,4.9,1,False
11-11-2025 10:00,52.089770561127374,5.109876746789877,2025-11-11T11:00:00+01:00,3511,code_yellow,3,4.6,1,True
11-11-2025 10:00,52.089770561127374,5.109876746789877,2025-11-11T17:00:00+01:00,3511,code_yellow,3,4.6,1,True
11-11-2025 10:00,52.089770561127374,5.109876746789877,2025-11-11T23:00:00+01:00,3511,code_yellow,3,4.6,1,False
11-11-2025 10:00,52.089770561127374,5.109876746789877,2025-11-12T05:00:00+01:00,3511,code_yellow,3,4.6,1,False
11-11-2025 16:00,52.089770561127374,5.109876746789877,2025-11-11T17:00:00+01:00,3511,code_yellow,3,4.3,1,True
11-11-2025 16:00,52.089770561127374,5.109876746789877,2025-11-11T23:00:00+01:00,3511,code_yellow,3,4.3,1,True
11-11-2025 16:00,52.089770561127374,5.109876746789877,2025-11-12T05:00:00+01:00,3511,code_yellow,3,4.3,1,False
11-11-2025 16:00,52.089770561127374,5.109876746789877,2025-11-12T11:00:00+01:00,3511,code_yellow,3,4.3,1,False
11-11-2025 22:00,52.089770561127374,5.109876746789877,2025-11-11T23:00:00+01:00,3511,code_yellow,3,5.3,1,True
11-11-2025 22:00,52.089770561127374,5.109876746789877,2025-11-12T05:00:00+01:00,3511,code_yellow,3,5.3,1,True
11-11-2025 22:00,52.089770561127374,5.109876746789877,2025-11-12T11:00:00+01:00,3511,code_yellow,3,5.3,1,False
11-11-2025 22:00,52.089770561127374,5.109876746789877,2025-11-12T17:00:00+01:00,3511,code_yellow,3,5.3,1,False
11-11-2025 22:00,52.089770561127374,5.109876746789877,2025-11-11T23:00:00+01:00,3511,code_yellow,3,5.3,1,True
11-11-2025 22:00,52.089770561127374,5.109876746789877,2025-11-12T05:00:00+01:00,3511,code_yellow,3,5.3,1,True
11-11-2025 22:00,52.089770561127374,5.109876746789877,2025-11-12T11:00:00+01:00,3511,code_yellow,3,5.3,1,False
11-11-2025 22:00,52.089770561127374,5.109876746789877,2025-11-12T17:00:00+01:00,3511,code_yellow,3,5.3,1,False
12-11-2025 10:00,52.089770561127374,5.109876746789877,2025-11-12T11:00:00+01:00,3511,code_yellow,3,5.3,1,True
12-11-2025 10:00,52.089770561127374,5.109876746789877,2025-11-12T17:00:00+01:00,3511,code_yellow,3,5.3,1,False
12-11-2025 10:00,52.089770561127374,5.109876746789877,2025-11-12T23:00:00+01:00,3511,code_yellow,3,5.3,1,False
12-11-2025 10:00,52.089770561127374,5.109876746789877,2025-11-13T05:00:00+01:00,3511,code_yellow,3,5.3,1,False
12-11-2025 16:00,52.089770561127374,5.109876746789877,2025-11-12T17:00:00+01:00,3511,code_yellow,3,4.3,1,True
12-11-2025 16:00,52.089770561127374,5.109876746789877,2025-11-12T23:00:00+01:00,3511,code_yellow,3,4.3,1,True
12-11-2025 16:00,52.089770561127374,5.109876746789877,2025-11-13T05:00:00+01:00,3511,code_yellow,3,4.3,1,False
12-11-2025 16:00,52.089770561127374,5.109876746789877,2025-11-13T11:00:00+01:00,3511,code_yellow,3,4.3,1,False
12-11-2025 22:00,52.089770561127374,5.109876746789877,2025-11-12T23:00:00+01:00,3511,code_yellow,3,4.0,1,True
12-11-2025 22:00,52.089770561127374,5.109876746789877,2025-11-13T05:00:00+01:00,3511,code_yellow,3,4.0,1,True
12-11-2025 22:00,52.089770561127374,5.109876746789877,2025-11-13T11:00:00+01:00,3511,code_yellow,3,4.0,1,False
12-11-2025 22:00,52.089770561127374,5.109876746789877,2025-11-13T17:00:00+01:00,3511,code_red,3,4.0,1,False
13-11-2025 04:00,52.089770561127374,5.109876746789877,2025-11-13T05:00:00+01:00,3511,code_yellow,4,5.7,1,True
13-11-2025 04:00,52.089770561127374,5.109876746789877,2025-11-13T11:00:00+01:00,3511,code_yellow,4,5.7,1,True
13-11-2025 04:00,52.089770561127374,5.109876746789877,2025-11-13T17:00:00+01:00,3511,code_red,4,5.7,1,False
13-11-2025 04:00,52.089770561127374,5.109876746789877,2025-11-13T23:00:00+01:00,3511,code_red,4,5.7,1,False
13-11-2025 10:00,52.089770561127374,5.109876746789877,2025-11-13T11:00:00+01:00,3511,code_yellow,3,4.2,1,True
13-11-2025 10:00,52.089770561127374,5.109876746789877,2025-11-13T17:00:00+01:00,3511,code_red,3,4.2,1,True
13-11-2025 10:00,52.089770561127374,5.109876746789877,2025-11-13T23:00:00+01:00,3511,code_red,3,4.2,1,False
13-11-2025 10:00,52.089770561127374,5.109876746789877,2025-11-14T05:00:00+01:00,3511,code_red,3,4.2,1,False
13-11-2025 16:00,52.089770561127374,5.109876746789877,2025-11-13T17:00:00+01:00,3511,code_red,2,2.3,1,True
13-11-2025 16:00,52.089770561127374,5.109876746789877,2025-11-13T23:00:00+01:00,3511,code_red,2,2.3,1,True
13-11-2025 16:00,52.089770561127374,5.109876746789877,2025-11-14T05:00:00+01:00,3511,code_red,2,2.3,1,False
13-11-2025 16:00,52.089770561127374,5.109876746789877,2025-11-14T11:00:00+01:00,3511,code_red,2,2.3,1,False
13-11-2025 22:00,52.089770561127374,5.109876746789877,2025-11-13T23:00:00+01:00,3511,code_red,2,2.0,1,True
13-11-2025 22:00,52.089770561127374,5.109876746789877,2025-11-14T05:00:00+01:00,3511,code_red,2,2.0,1,True
13-11-2025 22:00,52.089770561127374,5.109876746789877,2025-11-14T11:00:00+01:00,3511,code_red,2,2.0,1,False
13-11-2025 22:00,52.089770561127374,5.109876746789877,2025-11-14T17:00:00+01:00,3511,code_yellow,2,2.0,1,False
14-11-2025 04:00,52.089770561127374,5.109876746789877,2025-11-14T05:00:00+01:00,3511,code_red,2,1.9,1,True
14-11-2025 04:00,52.089770561127374,5.109876746789877,2025-11-14T11:00:00+01:00,3511,code_red,2,1.9,1,True
14-11-2025 04:00,52.089770561127374,5.109876746789877,2025-11-14T17:00:00+01:00,3511,code_yellow,2,1.9,1,False
14-11-2025 04:00,52.089770561127374,5.109876746789877,2025-11-14T23:00:00+01:00,3511,code_yellow,2,1.9,1,False
14-11-2025 10:00,52.089770561127374,5.109876746789877,2025-11-14T11:00:00+01:00,3511,code_red,2,2.1,2,True
14-11-2025 10:00,52.089770561127374,5.109876746789877,2025-11-14T17:00:00+01:00,3511,code_red,2,2.1,2,True
14-11-2025 10:00,52.089770561127374,5.109876746789877,2025-11-14T23:00:00+01:00,3511,code_red,2,2.1,2,False
14-11-2025 10:00,52.089770561127374,5.109876746789877,2025-11-15T05:00:00+01:00,3511,code_red,2,2.1,2,False
14-11-2025 16:00,52.089770561127374,5.109876746789877,2025-11-14T17:00:00+01:00,3511,code_red,2,2.9,1,True
14-11-2025 16:00,52.089770561127374,5.109876746789877,2025-11-14T23:00:00+01:00,3511,code_yellow,2,2.9,1,True
14-11-2025 16:00,52.089770561127374,5.109876746789877,2025-11-15T05:00:00+01:00,3511,code_yellow,2,2.9,1,False
14-11-2025 16:00,52.089770561127374,5.109876746789877,2025-11-15T11:00:00+01:00,3511,code_red,2,2.9,1,False
14-11-2025 22:00,52.089770561127374,5.109876746789877,2025-11-14T23:00:00+01:00,3511,code_yellow,3,4.0,1,True
14-11-2025 22:00,52.089770561127374,5.109876746789877,2025-11-15T05:00:00+01:00,3511,code_yellow,3,4.0,1,True
14-11-2025 22:00,52.089770561127374,5.109876746789877,2025-11-15T11:00:00+01:00,3511,code_red,3,4.0,1,False
14-11-2025 22:00,52.089770561127374,5.109876746789877,2025-11-15T17:00:00+01:00,3511,code_red,3,4.0,1,False
15-11-2025 04:00,52.089770561127374,5.109876746789877,2025-11-15T05:00:00+01:00,3511,code_yellow,3,4.0,1,True
15-11-2025 04:00,52.089770561127374,5.109876746789877,2025-11-15T11:00:00+01:00,3511,code_red,3,4.0,1,True
15-11-2025 04:00,52.089770561127374,5.109876746789877,2025-11-15T17:00:00+01:00,3511,code_red,3,4.0,1,False
15-11-2025 04:00,52.089770561127374,5.109876746789877,2025-11-15T23:00:00+01:00,3511,code_red,3,4.0,1,False
15-11-2025 10:00,52.089770561127374,5.109876746789877,2025-11-15T11:00:00+01:00,3511,code_red,2,2.6,1,True
15-11-2025 10:00,52.089770561127374,5.109876746789877,2025-11-15T17:00:00+01:00,3511,code_red,2,2.6,1,True
15-11-2025 10:00,52.089770561127374,5.109876746789877,2025-11-15T23:00:00+01:00,3511,code_red,2,2.6,1,False
15-11-2025 10:00,52.089770561127374,5.109876746789877,2025-11-16T05:00:00+01:00,3511,code_red,2,2.6,1,False
15-11-2025 16:00,52.089770561127374,5.109876746789877,2025-11-15T17:00:00+01:00,3511,code_red,2,2.0,1,True
15-11-2025 16:00,52.089770561127374,5.109876746789877,2025-11-15T23:00:00+01:00,3511,code_red,2,2.0,1,True
15-11-2025 16:00,52.089770561127374,5.109876746789877,2025-11-16T05:00:00+01:00,3511,code_red,2,2.0,1,False
15-11-2025 16:00,52.089770561127374,5.109876746789877,2025-11-16T11:00:00+01:00,3511,code_yellow,2,2.0,1,False
15-11-2025 22:00,52.089770561127374,5.109876746789877,2025-11-15T23:00:00+01:00,3511,code_red,2,2.3,1,True
15-11-2025 22:00,52.089770561127374,5.109876746789877,2025-11-16T05:00:00+01:00,3511,code_red,2,2.3,1,True
15-11-2025 22:00,52.089770561127374,5.109876746789877,2025-11-16T11:00:00+01:00,3511,code_yellow,2,2.3,1,False
15-11-2025 22:00,52.089770561127374,5.109876746789877,2025-11-16T17:00:00+01:00,3511,code_red,2,2.3,1,False
16-11-2025 04:00,52.089770561127374,5.109876746789877,2025-11-16T05:00:00+01:00,3511,code_red,2,2.9,1,True
16-11-2025 04:00,52.089770561127374,5.109876746789877,2025-11-16T11:00:00+01:00,3511,code_yellow,2,2.9,1,True
16-11-2025 04:00,52.089770561127374,5.109876746789877,2025-11-16T17:00:00+01:00,3511,code_red,2,2.9,1,False
16-11-2025 04:00,52.089770561127374,5.109876746789877,2025-11-16T23:00:00+01:00,3511,code_red,2,2.9,1,False
16-11-2025 10:00,52.089770561127374,5.109876746789877,2025-11-16T11:00:00+01:00,3511,code_yellow,3,4.0,1,True
16-11-2025 10:00,52.089770561127374,5.109876746789877,2025-11-16T17:00:00+01:00,3511,code_red,3,4.0,1,True
16-11-2025 10:00,52.089770561127374,5.109876746789877,2025-11-16T23:00:00+01:00,3511,code_red,3,4.0,1,False
16-11-2025 10:00,52.089770561127374,5.109876746789877,2025-11-17T05:00:00+01:00,3511,code_yellow,3,4.0,1,False
16-11-2025 16:00,52.089770561127374,5.109876746789877,2025-11-16T17:00:00+01:00,3511,code_red,2,2.2,1,True
16-11-2025 16:00,52.089770561127374,5.109876746789877,2025-11-16T23:00:00+01:00,3511,code_red,2,2.2,1,True
16-11-2025 16:00,52.089770561127374,5.109876746789877,2025-11-17T05:00:00+01:00,3511,code_yellow,2,2.2,1,False
16-11-2025 16:00,52.089770561127374,5.109876746789877,2025-11-17T11:00:00+01:00,3511,code_yellow,2,2.2,1,False
16-11-2025 22:00,52.089770561127374,5.109876746789877,2025-11-16T23:00:00+01:00,3511,code_red,2,3.2,1,True
16-11-2025 22:00,52.089770561127374,5.109876746789877,2025-11-17T05:00:00+01:00,3511,code_yellow,2,3.2,1,True
16-11-2025 22:00,52.089770561127374,5.109876746789877,2025-11-17T11:00:00+01:00,3511,code_yellow,2,3.2,1,False
16-11-2025 22:00,52.089770561127374,5.109876746789877,2025-11-17T17:00:00+01:00,3511,code_red,2,3.2,1,False
17-11-2025 04:00,52.089770561127374,5.109876746789877,2025-11-17T05:00:00+01:00,3511,code_yellow,3,3.8,1,True
17-11-2025 04:00,52.089770561127374,5.109876746789877,2025-11-17T11:00:00+01:00,3511,code_yellow,3,3.8,1,True
17-11-2025 04:00,52.089770561127374,5.109876746789877,2025-11-17T17:00:00+01:00,3511,code_red,3,3.8,1,False
17-11-2025 04:00,52.089770561127374,5.109876746789877,2025-11-17T23:00:00+01:00,3511,code_yellow,3,3.8,1,False
17-11-2025 10:00,52.089770561127374,5.109876746789877,2025-11-17T11:00:00+01:00,3511,code_yellow,3,4.5,1,True
17-11-2025 10:00,52.089770561127374,5.109876746789877,2025-11-17T17:00:00+01:00,3511,code_red,3,4.5,1,True
17-11-2025 10:00,52.089770561127374,5.109876746789877,2025-11-17T23:00:00+01:00,3511,code_yellow,3,4.5,1,False
17-11-2025 10:00,52.089770561127374,5.109876746789877,2025-11-18T05:00:00+01:00,3511,code_yellow,3,4.5,1,False
17-11-2025 16:00,52.089770561127374,5.109876746789877,2025-11-17T17:00:00+01:00,3511,code_red,2,2.8,1,True
17-11-2025 16:00,52.089770561127374,5.109876746789877,2025-11-17T23:00:00+01:00,3511,code_red,2,2.8,1,True
17-11-2025 16:00,52.089770561127374,5.109876746789877,2025-11-18T05:00:00+01:00,3511,code_red,2,2.8,1,False
17-11-2025 16:00,52.089770561127374,5.109876746789877,2025-11-18T11:00:00+01:00,3511,code_yellow,2,2.8,1,False
17-11-2025 22:00,52.089770561127374,5.109876746789877,2025-11-17T23:00:00+01:00,3511,code_red,2,3.3,1,True
17-11-2025 22:00,52.089770561127374,5.109876746789877,2025-11-18T05:00:00+01:00,3511,code_red,2,3.3,1,True
17-11-2025 22:00,52.089770561127374,5.109876746789877,2025-11-18T11:00:00+01:00,3511,code_yellow,2,3.3,1,False
17-11-2025 22:00,52.089770561127374,5.109876746789877,2025-11-18T17:00:00+01:00,3511,code_yellow,2,3.3,1,False
18-11-2025 04:00,52.089770561127374,5.109876746789877,2025-11-18T05:00:00+01:00,3511,code_red,2,3.3,1,True
18-11-2025 04:00,52.089770561127374,5.109876746789877,2025-11-18T11:00:00+01:00,3511,code_yellow,2,3.3,1,True
18-11-2025 04:00,52.089770561127374,5.109876746789877,2025-11-18T17:00:00+01:00,3511,code_yellow,2,3.3,1,False
18-11-2025 04:00,52.089770561127374,5.109876746789877,2025-11-18T23:00:00+01:00,3511,code_yellow,2,3.3,1,False
18-11-2025 10:00,52.089770561127374,5.109876746789877,2025-11-18T11:00:00+01:00,3511,code_yellow,3,4.7,1,True
18-11-2025 10:00,52.089770561127374,5.109876746789877,2025-11-18T17:00:00+01:00,3511,code_yellow,3,4.7,1,True
18-11-2025 10:00,52.089770561127374,5.109876746789877,2025-11-18T23:00:00+01:00,3511,code_yellow,3,4.7,1,False
18-11-2025 10:00,52.089770561127374,5.109876746789877,2025-11-19T05:00:00+01:00,3511,code_yellow,3,4.7,1,False
18-11-2025 16:00,52.089770561127374,5.109876746789877,2025-11-18T17:00:00+01:00,3511,code_yellow,3,5.1,1,True
18-11-2025 16:00,52.089770561127374,5.109876746789877,2025-11-18T23:00:00+01:00,3511,code_yellow,3,5.1,1,True
18-11-2025 16:00,52.089770561127374,5.109876746789877,2025-11-19T05:00:00+01:00,3511,code_yellow,3,5.1,1,False
18-11-2025 16:00,52.089770561127374,5.109876746789877,2025-11-19T11:00:00+01:00,3511,code_yellow,3,5.1,1,False
18-11-2025 22:00,52.089770561127374,5.109876746789877,2025-11-18T23:00:00+01:00,3511,code_yellow,4,6.4,1,True
18-11-2025 22:00,52.089770561127374,5.109876746789877,2025-11-19T05:00:00+01:00,3511,code_yellow,4,6.4,1,True
18-11-2025 22:00,52.089770561127374,5.109876746789877,2025-11-19T11:00:00+01:00,3511,code_red,4,6.4,1,False
18-11-2025 22:00,52.089770561127374,5.109876746789877,2025-11-19T17:00:00+01:00,3511,code_yellow,4,6.4,1,False
19-11-2025 04:00,52.089770561127374,5.109876746789877,2025-11-19T05:00:00+01:00,3511,code_yellow,4,6.0,1,True
19-11-2025 04:00,52.089770561127374,5.109876746789877,2025-11-19T11:00:00+01:00,3511,code_red,4,6.0,1,True
19-11-2025 04:00,52.089770561127374,5.109876746789877,2025-11-19T17:00:00+01:00,3511,code_yellow,4,6.0,1,False
19-11-2025 04:00,52.089770561127374,5.109876746789877,2025-11-19T23:00:00+01:00,3511,code_red,4,6.0,1,False
19-11-2025 10:00,52.089770561127374,5.109876746789877,2025-11-19T11:00:00+01:00,3511,code_red,2,2.4,1,True
19-11-2025 10:00,52.089770561127374,5.109876746789877,2025-11-19T17:00:00+01:00,3511,code_yellow,2,2.4,1,True
19-11-2025 10:00,52.089770561127374,5.109876746789877,2025-11-19T23:00:00+01:00,3511,code_red,2,2.4,1,False
19-11-2025 10:00,52.089770561127374,5.109876746789877,2025-11-20T05:00:00+01:00,3511,code_red,2,2.4,1,False
19-11-2025 16:00,52.089770561127374,5.109876746789877,2025-11-19T17:00:00+01:00,3511,code_yellow,3,4.0,1,True
19-11-2025 16:00,52.089770561127374,5.109876746789877,2025-11-19T23:00:00+01:00,3511,code_red,3,4.0,1,True
19-11-2025 16:00,52.089770561127374,5.109876746789877,2025-11-20T05:00:00+01:00,3511,code_red,3,4.0,1,False
19-11-2025 16:00,52.089770561127374,5.109876746789877,2025-11-20T11:00:00+01:00,3511,code_red,3,4.0,1,False
19-11-2025 22:00,52.089770561127374,5.109876746789877,2025-11-19T23:00:00+01:00,3511,code_red,2,2.5,1,True
19-11-2025 22:00,52.089770561127374,5.109876746789877,2025-11-20T05:00:00+01:00,3511,code_red,2,2.5,1,True
19-11-2025 22:00,52.089770561127374,5.109876746789877,2025-11-20T11:00:00+01:00,3511,code_red,2,2.5,1,False
19-11-2025 22:00,52.089770561127374,5.109876746789877,2025-11-20T17:00:00+01:00,3511,code_red,2,2.5,1,False
20-11-2025 04:00,52.089770561127374,5.109876746789877,2025-11-20T05:00:00+01:00,3511,code_red,2,1.9,1,True
20-11-2025 04:00,52.089770561127374,5.109876746789877,2025-11-20T11:00:00+01:00,3511,code_red,2,1.9,1,True
20-11-2025 04:00,52.089770561127374,5.109876746789877,2025-11-20T17:00:00+01:00,3511,code_red,2,1.9,1,False
20-11-2025 04:00,52.089770561127374,5.109876746789877,2025-11-20T23:00:00+01:00,3511,code_red,2,1.9,1,False
20-11-2025 10:00,52.089770561127374,5.109876746789877,2025-11-20T11:00:00+01:00,3511,code_red,2,2.8,1,True
20-11-2025 10:00,52.089770561127374,5.109876746789877,2025-11-20T17:00:00+01:00,3511,code_red,2,2.8,1,True
20-11-2025 10:00,52.089770561127374,5.109876746789877,2025-11-20T23:00:00+01:00,3511,code_red,2,2.8,1,False
20-11-2025 10:00,52.089770561127374,5.109876746789877,2025-11-21T05:00:00+01:00,3511,code_red,2,2.8,1,False
20-11-2025 16:00,52.089770561127374,5.109876746789877,2025-11-20T17:00:00+01:00,3511,code_red,2,2.7,1,True
20-11-2025 16:00,52.089770561127374,5.109876746789877,2025-11-20T23:00:00+01:00,3511,code_red,2,2.7,1,True
20-11-2025 16:00,52.089770561127374,5.109876746789877,2025-11-21T05:00:00+01:00,3511,code_red,2,2.7,1,False
20-11-2025 16:00,52.089770561127374,5.109876746789877,2025-11-21T11:00:00+01:00,3511,code_red,2,2.7,1,False
20-11-2025 22:00,52.089770561127374,5.109876746789877,2025-11-20T23:00:00+01:00,3511,code_red,2,2.5,1,True
20-11-2025 22:00,52.089770561127374,5.109876746789877,2025-11-21T05:00:00+01:00,3511,code_red,2,2.5,1,True
20-11-2025 22:00,52.089770561127374,5.109876746789877,2025-11-21T11:00:00+01:00,3511,code_red,2,2.5,1,False
20-11-2025 22:00,52.089770561127374,5.109876746789877,2025-11-21T17:00:00+01:00,3511,code_red,2,2.5,1,False
20-11-2025 22:00,52.089770561127374,5.109876746789877,2025-11-20T23:00:00+01:00,3511,code_red,2,2.5,1,True
20-11-2025 22:00,52.089770561127374,5.109876746789877,2025-11-21T05:00:00+01:00,3511,code_red,2,2.5,1,True
20-11-2025 22:00,52.089770561127374,5.109876746789877,2025-11-21T11:00:00+01:00,3511,code_red,2,2.5,1,False
20-11-2025 22:00,52.089770561127374,5.109876746789877,2025-11-21T17:00:00+01:00,3511,code_red,2,2.5,1,False
20-11-2025 22:00,52.089770561127374,5.109876746789877,2025-11-20T23:00:00+01:00,3511,code_red,2,2.5,1,True
20-11-2025 22:00,52.089770561127374,5.109876746789877,2025-11-21T05:00:00+01:00,3511,code_red,2,2.5,1,True
20-11-2025 22:00,52.089770561127374,5.109876746789877,2025-11-21T11:00:00+01:00,3511,code_red,2,2.5,1,False
20-11-2025 22:00,52.089770561127374,5.109876746789877,2025-11-21T17:00:00+01:00,3511,code_red,2,2.5,1,False
21-11-2025 16:00,52.089770561127374,5.109876746789877,2025-11-21T17:00:00+01:00,3511,code_red,2,2.6,2,True
21-11-2025 16:00,52.089770561127374,5.109876746789877,2025-11-21T23:00:00+01:00,3511,code_red,2,2.6,2,False
21-11-2025 16:00,52.089770561127374,5.109876746789877,2025-11-22T05:00:00+01:00,3511,code_yellow,2,2.6,2,False
21-11-2025 16:00,52.089770561127374,5.109876746789877,2025-11-22T11:00:00+01:00,3511,code_yellow,2,2.6,2,False
21-11-2025 22:00,52.089770561127374,5.109876746789877,2025-11-21T23:00:00+01:00,3511,code_red,2,3.1,2,True
21-11-2025 22:00,52.089770561127374,5.109876746789877,2025-11-22T05:00:00+01:00,3511,code_yellow,2,3.1,2,True
21-11-2025 22:00,52.089770561127374,5.109876746789877,2025-11-22T11:00:00+01:00,3511,code_yellow,2,3.1,2,False
21-11-2025 22:00,52.089770561127374,5.109876746789877,2025-11-22T17:00:00+01:00,3511,code_yellow,2,3.1,2,False
22-11-2025 04:00,52.089770561127374,5.109876746789877,2025-11-22T05:00:00+01:00,3511,code_yellow,3,4.6,2,True
22-11-2025 04:00,52.089770561127374,5.109876746789877,2025-11-22T11:00:00+01:00,3511,code_yellow,3,4.6,2,True
22-11-2025 04:00,52.089770561127374,5.109876746789877,2025-11-22T17:00:00+01:00,3511,code_yellow,3,4.6,2,False
22-11-2025 04:00,52.089770561127374,5.109876746789877,2025-11-22T23:00:00+01:00,3511,code_yellow,3,4.6,2,False
22-11-2025 10:00,52.089770561127374,5.109876746789877,2025-11-22T11:00:00+01:00,3511,code_yellow,3,5.2,2,True
22-11-2025 10:00,52.089770561127374,5.109876746789877,2025-11-22T17:00:00+01:00,3511,code_yellow,3,5.2,2,True
22-11-2025 10:00,52.089770561127374,5.109876746789877,2025-11-22T23:00:00+01:00,3511,code_yellow,3,5.2,2,False
22-11-2025 10:00,52.089770561127374,5.109876746789877,2025-11-23T05:00:00+01:00,3511,code_yellow,3,5.2,2,False
22-11-2025 16:00,52.089770561127374,5.109876746789877,2025-11-22T17:00:00+01:00,3511,code_yellow,3,4.8,2,True
22-11-2025 16:00,52.089770561127374,5.109876746789877,2025-11-22T23:00:00+01:00,3511,code_yellow,3,4.8,2,True
22-11-2025 16:00,52.089770561127374,5.109876746789877,2025-11-23T05:00:00+01:00,3511,code_yellow,3,4.8,2,False
22-11-2025 16:00,52.089770561127374,5.109876746789877,2025-11-23T11:00:00+01:00,3511,code_yellow,3,4.8,2,False
22-11-2025 22:00,52.089770561127374,5.109876746789877,2025-11-22T23:00:00+01:00,3511,code_yellow,3,5.3,1,True
22-11-2025 22:00,52.089770561127374,5.109876746789877,2025-11-23T05:00:00+01:00,3511,code_yellow,3,5.3,1,True
22-11-2025 22:00,52.089770561127374,5.109876746789877,2025-11-23T11:00:00+01:00,3511,code_yellow,3,5.3,1,False
22-11-2025 22:00,52.089770561127374,5.109876746789877,2025-11-23T17:00:00+01:00,3511,code_yellow,3,5.3,1,False
23-11-2025 04:00,52.089770561127374,5.109876746789877,2025-11-23T05:00:00+01:00,3511,code_yellow,4,6.5,1,True
23-11-2025 04:00,52.089770561127374,5.109876746789877,2025-11-23T11:00:00+01:00,3511,code_yellow,4,6.5,1,True
23-11-2025 04:00,52.089770561127374,5.109876746789877,2025-11-23T17:00:00+01:00,3511,code_yellow,4,6.5,1,False
23-11-2025 04:00,52.089770561127374,5.109876746789877,2025-11-23T23:00:00+01:00,3511,code_yellow,4,6.5,1,False
23-11-2025 10:00,52.089770561127374,5.109876746789877,2025-11-23T11:00:00+01:00,3511,code_yellow,4,6.7,1,True
23-11-2025 10:00,52.089770561127374,5.109876746789877,2025-11-23T17:00:00+01:00,3511,code_yellow,4,6.7,1,True
23-11-2025 10:00,52.089770561127374,5.109876746789877,2025-11-23T23:00:00+01:00,3511,code_yellow,4,6.7,1,False
23-11-2025 10:00,52.089770561127374,5.109876746789877,2025-11-24T05:00:00+01:00,3511,code_yellow,4,6.7,1,False
23-11-2025 16:00,52.089770561127374,5.109876746789877,2025-11-23T17:00:00+01:00,3511,code_yellow,3,5.4,1,True
23-11-2025 16:00,52.089770561127374,5.109876746789877,2025-11-23T23:00:00+01:00,3511,code_yellow,3,5.4,1,True
23-11-2025 16:00,52.089770561127374,5.109876746789877,2025-11-24T05:00:00+01:00,3511,code_yellow,3,5.4,1,False
23-11-2025 16:00,52.089770561127374,5.109876746789877,2025-11-24T11:00:00+01:00,3511,code_red,3,5.4,1,False
23-11-2025 22:00,52.089770561127374,5.109876746789877,2025-11-23T23:00:00+01:00,3511,code_yellow,4,5.5,1,True
23-11-2025 22:00,52.089770561127374,5.109876746789877,2025-11-24T05:00:00+01:00,3511,code_yellow,4,5.5,1,True
23-11-2025 22:00,52.089770561127374,5.109876746789877,2025-11-24T11:00:00+01:00,3511,code_red,4,5.5,1,False
23-11-2025 22:00,52.089770561127374,5.109876746789877,2025-11-24T17:00:00+01:00,3511,code_red,4,5.5,1,False
24-11-2025 04:00,52.089770561127374,5.109876746789877,2025-11-24T05:00:00+01:00,3511,code_yellow,3,3.6,1,True
24-11-2025 04:00,52.089770561127374,5.109876746789877,2025-11-24T11:00:00+01:00,3511,code_red,3,3.6,1,True
24-11-2025 04:00,52.089770561127374,5.109876746789877,2025-11-24T17:00:00+01:00,3511,code_red,3,3.6,1,False
24-11-2025 04:00,52.089770561127374,5.109876746789877,2025-11-24T23:00:00+01:00,3511,code_red,3,3.6,1,False
24-11-2025 10:00,52.089770561127374,5.109876746789877,2025-11-24T11:00:00+01:00,3511,code_red,2,2.6,1,True
24-11-2025 10:00,52.089770561127374,5.109876746789877,2025-11-24T17:00:00+01:00,3511,code_red,2,2.6,1,True
24-11-2025 10:00,52.089770561127374,5.109876746789877,2025-11-24T23:00:00+01:00,3511,code_red,2,2.6,1,False
24-11-2025 10:00,52.089770561127374,5.109876746789877,2025-11-25T05:00:00+01:00,3511,code_red,2,2.6,1,False
24-11-2025 16:00,52.089770561127374,5.109876746789877,2025-11-24T17:00:00+01:00,3511,code_red,2,1.7,1,True
24-11-2025 16:00,52.089770561127374,5.109876746789877,2025-11-24T23:00:00+01:00,3511,code_red,2,1.7,1,True
24-11-2025 16:00,52.089770561127374,5.109876746789877,2025-11-25T05:00:00+01:00,3511,code_red,2,1.7,1,False
24-11-2025 16:00,52.089770561127374,5.109876746789877,2025-11-25T11:00:00+01:00,3511,code_yellow,2,1.7,1,False
24-11-2025 22:00,52.089770561127374,5.109876746789877,2025-11-24T23:00:00+01:00,3511,code_red,1,1.5,1,True
24-11-2025 22:00,52.089770561127374,5.109876746789877,2025-11-25T05:00:00+01:00,3511,code_red,1,1.5,1,True
24-11-2025 22:00,52.089770561127374,5.109876746789877,2025-11-25T11:00:00+01:00,3511,code_yellow,1,1.5,1,False
24-11-2025 22:00,52.089770561127374,5.109876746789877,2025-11-25T17:00:00+01:00,3511,code_yellow,1,1.5,1,False
25-11-2025 04:00,52.089770561127374,5.109876746789877,2025-11-25T05:00:00+01:00,3511,code_red,2,1.9,2,True
25-11-2025 04:00,52.089770561127374,5.109876746789877,2025-11-25T11:00:00+01:00,3511,code_yellow,2,1.9,2,True
25-11-2025 04:00,52.089770561127374,5.109876746789877,2025-11-25T17:00:00+01:00,3511,code_yellow,2,1.9,2,False
25-11-2025 04:00,52.089770561127374,5.109876746789877,2025-11-25T23:00:00+01:00,3511,code_red,2,1.9,2,False
25-11-2025 10:00,52.089770561127374,5.109876746789877,2025-11-25T11:00:00+01:00,3511,code_yellow,3,3.4,1,True
25-11-2025 10:00,52.089770561127374,5.109876746789877,2025-11-25T17:00:00+01:00,3511,code_red,3,3.4,1,True
25-11-2025 10:00,52.089770561127374,5.109876746789877,2025-11-25T23:00:00+01:00,3511,code_red,3,3.4,1,False
25-11-2025 10:00,52.089770561127374,5.109876746789877,2025-11-26T05:00:00+01:00,3511,code_red,3,3.4,1,False
25-11-2025 16:00,52.089770561127374,5.109876746789877,2025-11-25T17:00:00+01:00,3511,code_red,2,3.3,1,True
25-11-2025 16:00,52.089770561127374,5.109876746789877,2025-11-25T23:00:00+01:00,3511,code_red,2,3.3,1,True
25-11-2025 16:00,52.089770561127374,5.109876746789877,2025-11-26T05:00:00+01:00,3511,code_red,2,3.3,1,False
25-11-2025 16:00,52.089770561127374,5.109876746789877,2025-11-26T11:00:00+01:00,3511,code_red,2,3.3,1,False
25-11-2025 22:00,52.089770561127374,5.109876746789877,2025-11-25T23:00:00+01:00,3511,code_red,2,2.8,1,True
25-11-2025 22:00,52.089770561127374,5.109876746789877,2025-11-26T05:00:00+01:00,3511,code_red,2,2.8,1,True
25-11-2025 22:00,52.089770561127374,5.109876746789877,2025-11-26T11:00:00+01:00,3511,code_red,2,2.8,1,False
25-11-2025 22:00,52.089770561127374,5.109876746789877,2025-11-26T17:00:00+01:00,3511,code_red,2,2.8,1,False
26-11-2025 04:00,52.089770561127374,5.109876746789877,2025-11-26T05:00:00+01:00,3511,code_red,2,1.6,2,True
26-11-2025 04:00,52.089770561127374,5.109876746789877,2025-11-26T11:00:00+01:00,3511,code_red,2,1.6,2,True
26-11-2025 04:00,52.089770561127374,5.109876746789877,2025-11-26T17:00:00+01:00,3511,code_red,2,1.6,2,False
26-11-2025 04:00,52.089770561127374,5.109876746789877,2025-11-26T23:00:00+01:00,3511,code_yellow,2,1.6,2,False
26-11-2025 10:00,52.089770561127374,5.109876746789877,2025-11-26T11:00:00+01:00,3511,code_red,1,1.1,2,True
26-11-2025 10:00,52.089770561127374,5.109876746789877,2025-11-26T17:00:00+01:00,3511,code_red,1,1.1,2,True
26-11-2025 10:00,52.089770561127374,5.109876746789877,2025-11-26T23:00:00+01:00,3511,code_yellow,1,1.1,2,False
26-11-2025 10:00,52.089770561127374,5.109876746789877,2025-11-27T05:00:00+01:00,3511,code_yellow,1,1.1,2,False
26-11-2025 16:00,52.089770561127374,5.109876746789877,2025-11-26T17:00:00+01:00,3511,code_red,2,2.5,2,True
26-11-2025 16:00,52.089770561127374,5.109876746789877,2025-11-26T23:00:00+01:00,3511,code_yellow,2,2.5,2,True
26-11-2025 16:00,52.089770561127374,5.109876746789877,2025-11-27T05:00:00+01:00,3511,code_yellow,2,2.5,2,False
26-11-2025 16:00,52.089770561127374,5.109876746789877,2025-11-27T11:00:00+01:00,3511,code_yellow,2,2.5,2,False
26-11-2025 22:00,52.089770561127374,5.109876746789877,2025-11-26T23:00:00+01:00,3511,code_yellow,3,4.2,2,True
26-11-2025 22:00,52.089770561127374,5.109876746789877,2025-11-27T05:00:00+01:00,3511,code_yellow,3,4.2,2,True
26-11-2025 22:00,52.089770561127374,5.109876746789877,2025-11-27T11:00:00+01:00,3511,code_yellow,3,4.2,2,False
26-11-2025 22:00,52.089770561127374,5.109876746789877,2025-11-27T17:00:00+01:00,3511,code_yellow,3,4.2,2,False
27-11-2025 04:00,52.089770561127374,5.109876746789877,2025-11-27T05:00:00+01:00,3511,code_yellow,4,5.7,2,True
27-11-2025 04:00,52.089770561127374,5.109876746789877,2025-11-27T11:00:00+01:00,3511,code_yellow,4,5.7,2,True
27-11-2025 04:00,52.089770561127374,5.109876746789877,2025-11-27T17:00:00+01:00,3511,code_yellow,4,5.7,2,False
27-11-2025 04:00,52.089770561127374,5.109876746789877,2025-11-27T23:00:00+01:00,3511,code_yellow,4,5.7,2,False
27-11-2025 10:00,52.089770561127374,5.109876746789877,2025-11-27T11:00:00+01:00,3511,code_yellow,4,5.9,2,True
27-11-2025 10:00,52.089770561127374,5.109876746789877,2025-11-27T17:00:00+01:00,3511,code_yellow,4,5.9,2,True
27-11-2025 10:00,52.089770561127374,5.109876746789877,2025-11-27T23:00:00+01:00,3511,code_yellow,4,5.9,2,False
27-11-2025 10:00,52.089770561127374,5.109876746789877,2025-11-28T05:00:00+01:00,3511,code_yellow,4,5.9,2,False
27-11-2025 16:00,52.089770561127374,5.109876746789877,2025-11-27T17:00:00+01:00,3511,code_yellow,4,5.7,1,True
27-11-2025 16:00,52.089770561127374,5.109876746789877,2025-11-27T23:00:00+01:00,3511,code_yellow,4,5.7,1,True
27-11-2025 16:00,52.089770561127374,5.109876746789877,2025-11-28T05:00:00+01:00,3511,code_yellow,4,5.7,1,False
27-11-2025 16:00,52.089770561127374,5.109876746789877,2025-11-28T11:00:00+01:00,3511,code_yellow,4,5.7,1,False
27-11-2025 22:00,52.089770561127374,5.109876746789877,2025-11-27T23:00:00+01:00,3511,code_yellow,3,5.4,1,True
27-11-2025 22:00,52.089770561127374,5.109876746789877,2025-11-28T05:00:00+01:00,3511,code_yellow,3,5.4,1,True
27-11-2025 22:00,52.089770561127374,5.109876746789877,2025-11-28T11:00:00+01:00,3511,code_yellow,3,5.4,1,False
27-11-2025 22:00,52.089770561127374,5.109876746789877,2025-11-28T17:00:00+01:00,3511,code_yellow,3,5.4,1,False
28-11-2025 04:00,52.089770561127374,5.109876746789877,2025-11-28T05:00:00+01:00,3511,code_yellow,3,4.8,2,True
28-11-2025 04:00,52.089770561127374,5.109876746789877,2025-11-28T11:00:00+01:00,3511,code_yellow,3,4.8,2,True
28-11-2025 04:00,52.089770561127374,5.109876746789877,2025-11-28T17:00:00+01:00,3511,code_yellow,3,4.8,2,False
28-11-2025 04:00,52.089770561127374,5.109876746789877,2025-11-28T23:00:00+01:00,3511,code_yellow,3,4.8,2,False
28-11-2025 10:00,52.089770561127374,5.109876746789877,2025-11-28T11:00:00+01:00,3511,code_yellow,3,4.9,1,True
28-11-2025 10:00,52.089770561127374,5.109876746789877,2025-11-28T17:00:00+01:00,3511,code_yellow,3,4.9,1,True
28-11-2025 10:00,52.089770561127374,5.109876746789877,2025-11-28T23:00:00+01:00,3511,code_yellow,3,4.9,1,False
28-11-2025 10:00,52.089770561127374,5.109876746789877,2025-11-29T05:00:00+01:00,3511,code_yellow,3,4.9,1,False
28-11-2025 16:00,52.089770561127374,5.109876746789877,2025-11-28T17:00:00+01:00,3511,code_yellow,3,5.4,1,True
28-11-2025 16:00,52.089770561127374,5.109876746789877,2025-11-28T23:00:00+01:00,3511,code_yellow,3,5.4,1,True
28-11-2025 16:00,52.089770561127374,5.109876746789877,2025-11-29T05:00:00+01:00,3511,code_yellow,3,5.4,1,False
28-11-2025 16:00,52.089770561127374,5.109876746789877,2025-11-29T11:00:00+01:00,3511,code_yellow,3,5.4,1,False
28-11-2025 22:00,52.089770561127374,5.109876746789877,2025-11-28T23:00:00+01:00,3511,code_yellow,3,4.5,1,True
28-11-2025 22:00,52.089770561127374,5.109876746789877,2025-11-29T05:00:00+01:00,3511,code_yellow,3,4.5,1,True
28-11-2025 22:00,52.089770561127374,5.109876746789877,2025-11-29T11:00:00+01:00,3511,code_yellow,3,4.5,1,False
28-11-2025 22:00,52.089770561127374,5.109876746789877,2025-11-29T17:00:00+01:00,3511,code_yellow,3,4.5,1,False
29-11-2025 04:00,52.089770561127374,5.109876746789877,2025-11-29T05:00:00+01:00,3511,code_yellow,4,5.5,1,True
29-11-2025 04:00,52.089770561127374,5.109876746789877,2025-11-29T11:00:00+01:00,3511,code_yellow,4,5.5,1,True
29-11-2025 04:00,52.089770561127374,5.109876746789877,2025-11-29T17:00:00+01:00,3511,code_yellow,4,5.5,1,False
29-11-2025 04:00,52.089770561127374,5.109876746789877,2025-11-29T23:00:00+01:00,3511,code_yellow,4,5.5,1,False
29-11-2025 10:00,52.089770561127374,5.109876746789877,2025-11-29T11:00:00+01:00,3511,code_yellow,4,5.6,1,True
29-11-2025 10:00,52.089770561127374,5.109876746789877,2025-11-29T17:00:00+01:00,3511,code_yellow,4,5.6,1,True
29-11-2025 10:00,52.089770561127374,5.109876746789877,2025-11-29T23:00:00+01:00,3511,code_yellow,4,5.6,1,False
29-11-2025 10:00,52.089770561127374,5.109876746789877,2025-11-30T05:00:00+01:00,3511,code_yellow,4,5.6,1,False
29-11-2025 16:00,52.089770561127374,5.109876746789877,2025-11-29T17:00:00+01:00,3511,code_yellow,4,5.6,1,True
29-11-2025 16:00,52.089770561127374,5.109876746789877,2025-11-29T23:00:00+01:00,3511,code_yellow,4,5.6,1,True
29-11-2025 16:00,52.089770561127374,5.109876746789877,2025-11-30T05:00:00+01:00,3511,code_yellow,4,5.6,1,False
29-11-2025 16:00,52.089770561127374,5.109876746789877,2025-11-30T11:00:00+01:00,3511,code_yellow,4,5.6,1,False
29-11-2025 22:00,52.089770561127374,5.109876746789877,2025-11-29T23:00:00+01:00,3511,code_yellow,3,4.3,1,True
29-11-2025 22:00,52.089770561127374,5.109876746789877,2025-11-30T05:00:00+01:00,3511,code_yellow,3,4.3,1,True
29-11-2025 22:00,52.089770561127374,5.109876746789877,2025-11-30T11:00:00+01:00,3511,code_yellow,3,4.3,1,False
29-11-2025 22:00,52.089770561127374,5.109876746789877,2025-11-30T17:00:00+01:00,3511,code_yellow,3,4.3,1,False
30-11-2025 04:00,52.089770561127374,5.109876746789877,2025-11-30T05:00:00+01:00,3511,code_yellow,3,4.7,1,True
30-11-2025 04:00,52.089770561127374,5.109876746789877,2025-11-30T11:00:00+01:00,3511,code_yellow,3,4.7,1,True
30-11-2025 04:00,52.089770561127374,5.109876746789877,2025-11-30T17:00:00+01:00,3511,code_yellow,3,4.7,1,False
30-11-2025 04:00,52.089770561127374,5.109876746789877,2025-11-30T23:00:00+01:00,3511,code_yellow,3,4.7,1,False
30-11-2025 10:00,52.089770561127374,5.109876746789877,2025-11-30T11:00:00+01:00,3511,code_yellow,3,4.7,1,True
30-11-2025 10:00,52.089770561127374,5.109876746789877,2025-11-30T17:00:00+01:00,3511,code_red,3,4.7,1,True
30-11-2025 10:00,52.089770561127374,5.109876746789877,2025-11-30T23:00:00+01:00,3511,code_yellow,3,4.7,1,False
30-11-2025 10:00,52.089770561127374,5.109876746789877,2025-12-01T05:00:00+01:00,3511,code_yellow,3,4.7,1,False
30-11-2025 16:00,52.089770561127374,5.109876746789877,2025-11-30T17:00:00+01:00,3511,code_red,2,3.3,1,True
30-11-2025 16:00,52.089770561127374,5.109876746789877,2025-11-30T23:00:00+01:00,3511,code_yellow,2,3.3,1,True
30-11-2025 16:00,52.089770561127374,5.109876746789877,2025-12-01T05:00:00+01:00,3511,code_yellow,2,3.3,1,False
30-11-2025 16:00,52.089770561127374,5.109876746789877,2025-12-01T11:00:00+01:00,3511,code_yellow,2,3.3,1,False
30-11-2025 22:00,52.089770561127374,5.109876746789877,2025-11-30T23:00:00+01:00,3511,code_yellow,3,4.0,1,True
30-11-2025 22:00,52.089770561127374,5.109876746789877,2025-12-01T05:00:00+01:00,3511,code_yellow,3,4.0,1,True
30-11-2025 22:00,52.089770561127374,5.109876746789877,2025-12-01T11:00:00+01:00,3511,code_yellow,3,4.0,1,False
30-11-2025 22:00,52.089770561127374,5.109876746789877,2025-12-01T17:00:00+01:00,3511,code_yellow,3,4.0,1,False
01-12-2025 04:00,52.089770561127374,5.109876746789877,2025-12-01T05:00:00+01:00,3511,code_yellow,4,6.0,1,True
01-12-2025 04:00,52.089770561127374,5.109876746789877,2025-12-01T11:00:00+01:00,3511,code_yellow,4,6.0,1,True
01-12-2025 04:00,52.089770561127374,5.109876746789877,2025-12-01T17:00:00+01:00,3511,code_yellow,4,6.0,1,False
01-12-2025 04:00,52.089770561127374,5.109876746789877,2025-12-01T23:00:00+01:00,3511,code_yellow,4,6.0,1,False
01-12-2025 10:00,52.089770561127374,5.109876746789877,2025-12-01T11:00:00+01:00,3511,code_yellow,4,7.7,1,True
01-12-2025 10:00,52.089770561127374,5.109876746789877,2025-12-01T17:00:00+01:00,3511,code_yellow,4,7.7,1,True
01-12-2025 10:00,52.089770561127374,5.109876746789877,2025-12-01T23:00:00+01:00,3511,code_yellow,4,7.7,1,False
01-12-2025 10:00,52.089770561127374,5.109876746789877,2025-12-02T05:00:00+01:00,3511,code_yellow,4,7.7,1,False
01-12-2025 16:00,52.089770561127374,5.109876746789877,2025-12-01T17:00:00+01:00,3511,code_yellow,4,7.3,1,True
01-12-2025 16:00,52.089770561127374,5.109876746789877,2025-12-01T23:00:00+01:00,3511,code_yellow,4,7.3,1,True
01-12-2025 16:00,52.089770561127374,5.109876746789877,2025-12-02T05:00:00+01:00,3511,code_yellow,4,7.3,1,False
01-12-2025 16:00,52.089770561127374,5.109876746789877,2025-12-02T11:00:00+01:00,3511,code_yellow,4,7.3,1,False
01-12-2025 22:00,52.089770561127374,5.109876746789877,2025-12-01T23:00:00+01:00,3511,code_yellow,4,6.9,1,True
01-12-2025 22:00,52.089770561127374,5.109876746789877,2025-12-02T05:00:00+01:00,3511,code_yellow,4,6.9,1,True
01-12-2025 22:00,52.089770561127374,5.109876746789877,2025-12-02T11:00:00+01:00,3511,code_yellow,4,6.9,1,False
01-12-2025 22:00,52.089770561127374,5.109876746789877,2025-12-02T17:00:00+01:00,3511,code_red,4,6.9,1,False
02-12-2025 04:00,52.089770561127374,5.109876746789877,2025-12-02T05:00:00+01:00,3511,code_yellow,3,5.4,1,True
02-12-2025 04:00,52.089770561127374,5.109876746789877,2025-12-02T11:00:00+01:00,3511,code_yellow,3,5.4,1,True
02-12-2025 04:00,52.089770561127374,5.109876746789877,2025-12-02T17:00:00+01:00,3511,code_red,3,5.4,1,False
02-12-2025 04:00,52.089770561127374,5.109876746789877,2025-12-02T23:00:00+01:00,3511,code_red,3,5.4,1,False
02-12-2025 10:00,52.089770561127374,5.109876746789877,2025-12-02T11:00:00+01:00,3511,code_yellow,3,4.0,1,True
02-12-2025 10:00,52.089770561127374,5.109876746789877,2025-12-02T17:00:00+01:00,3511,code_red,3,4.0,1,True
02-12-2025 10:00,52.089770561127374,5.109876746789877,2025-12-02T23:00:00+01:00,3511,code_red,3,4.0,1,False
02-12-2025 10:00,52.089770561127374,5.109876746789877,2025-12-03T05:00:00+01:00,3511,code_red,3,4.0,1,False
02-12-2025 16:00,52.089770561127374,5.109876746789877,2025-12-02T17:00:00+01:00,3511,code_red,2,3.3,1,True
02-12-2025 16:00,52.089770561127374,5.109876746789877,2025-12-02T23:00:00+01:00,3511,code_red,2,3.3,1,True
02-12-2025 16:00,52.089770561127374,5.109876746789877,2025-12-03T05:00:00+01:00,3511,code_red,2,3.3,1,False
02-12-2025 16:00,52.089770561127374,5.109876746789877,2025-12-03T11:00:00+01:00,3511,code_red,2,3.3,1,False
03-12-2025 10:00,52.089770561127374,5.109876746789877,2025-12-03T11:00:00+01:00,3511,code_red,2,2.4,1,True
03-12-2025 10:00,52.089770561127374,5.109876746789877,2025-12-03T17:00:00+01:00,3511,code_red,2,2.4,1,True
03-12-2025 10:00,52.089770561127374,5.109876746789877,2025-12-03T23:00:00+01:00,3511,code_red,2,2.4,1,False
03-12-2025 10:00,52.089770561127374,5.109876746789877,2025-12-04T05:00:00+01:00,3511,code_yellow,2,2.4,1,False
03-12-2025 16:00,52.089770561127374,5.109876746789877,2025-12-03T17:00:00+01:00,3511,code_red,2,2.5,1,True
03-12-2025 16:00,52.089770561127374,5.109876746789877,2025-12-03T23:00:00+01:00,3511,code_red,2,2.5,1,True
03-12-2025 16:00,52.089770561127374,5.109876746789877,2025-12-04T05:00:00+01:00,3511,code_yellow,2,2.5,1,False
03-12-2025 16:00,52.089770561127374,5.109876746789877,2025-12-04T11:00:00+01:00,3511,code_yellow,2,2.5,1,False
03-12-2025 22:00,52.089770561127374,5.109876746789877,2025-12-03T23:00:00+01:00,3511,code_red,2,2.4,1,True
03-12-2025 22:00,52.089770561127374,5.109876746789877,2025-12-04T05:00:00+01:00,3511,code_yellow,2,2.4,1,True
03-12-2025 22:00,52.089770561127374,5.109876746789877,2025-12-04T11:00:00+01:00,3511,code_yellow,2,2.4,1,False
03-12-2025 22:00,52.089770561127374,5.109876746789877,2025-12-04T17:00:00+01:00,3511,code_yellow,2,2.4,1,False
04-12-2025 04:00,52.089770561127374,5.109876746789877,2025-12-04T05:00:00+01:00,3511,code_yellow,3,3.9,1,True
04-12-2025 04:00,52.089770561127374,5.109876746789877,2025-12-04T11:00:00+01:00,3511,code_yellow,3,3.9,1,True
04-12-2025 04:00,52.089770561127374,5.109876746789877,2025-12-04T17:00:00+01:00,3511,code_yellow,3,3.9,1,False
04-12-2025 04:00,52.089770561127374,5.109876746789877,2025-12-04T23:00:00+01:00,3511,code_red,3,3.9,1,False
04-12-2025 10:00,52.089770561127374,5.109876746789877,2025-12-04T11:00:00+01:00,3511,code_yellow,3,5.4,1,True
04-12-2025 10:00,52.089770561127374,5.109876746789877,2025-12-04T17:00:00+01:00,3511,code_yellow,3,5.4,1,True
04-12-2025 10:00,52.089770561127374,5.109876746789877,2025-12-04T23:00:00+01:00,3511,code_red,3,5.4,1,False
04-12-2025 10:00,52.089770561127374,5.109876746789877,2025-12-05T05:00:00+01:00,3511,code_red,3,5.4,1,False
04-12-2025 16:00,52.089770561127374,5.109876746789877,2025-12-04T17:00:00+01:00,3511,code_yellow,3,4.5,1,True
04-12-2025 16:00,52.089770561127374,5.109876746789877,2025-12-04T23:00:00+01:00,3511,code_red,3,4.5,1,True
04-12-2025 16:00,52.089770561127374,5.109876746789877,2025-12-05T05:00:00+01:00,3511,code_red,3,4.5,1,False
04-12-2025 16:00,52.089770561127374,5.109876746789877,2025-12-05T11:00:00+01:00,3511,code_red,3,4.5,1,False
04-12-2025 22:00,52.089770561127374,5.109876746789877,2025-12-04T23:00:00+01:00,3511,code_red,2,2.5,1,True
04-12-2025 22:00,52.089770561127374,5.109876746789877,2025-12-05T05:00:00+01:00,3511,code_red,2,2.5,1,True
04-12-2025 22:00,52.089770561127374,5.109876746789877,2025-12-05T11:00:00+01:00,3511,code_yellow,2,2.5,1,False
04-12-2025 22:00,52.089770561127374,5.109876746789877,2025-12-05T17:00:00+01:00,3511,code_yellow,2,2.5,1,False
05-12-2025 04:00,52.089770561127374,5.109876746789877,2025-12-05T05:00:00+01:00,3511,code_red,2,2.8,1,True
05-12-2025 04:00,52.089770561127374,5.109876746789877,2025-12-05T11:00:00+01:00,3511,code_yellow,2,2.8,1,True
05-12-2025 04:00,52.089770561127374,5.109876746789877,2025-12-05T17:00:00+01:00,3511,code_yellow,2,2.8,1,False
05-12-2025 04:00,52.089770561127374,5.109876746789877,2025-12-05T23:00:00+01:00,3511,code_yellow,2,2.8,1,False
05-12-2025 10:00,52.089770561127374,5.109876746789877,2025-12-05T11:00:00+01:00,3511,code_yellow,3,3.6,2,True
05-12-2025 10:00,52.089770561127374,5.109876746789877,2025-12-05T17:00:00+01:00,3511,code_yellow,3,3.6,2,True
05-12-2025 10:00,52.089770561127374,5.109876746789877,2025-12-05T23:00:00+01:00,3511,code_yellow,3,3.6,2,False
05-12-2025 10:00,52.089770561127374,5.109876746789877,2025-12-06T05:00:00+01:00,3511,code_yellow,3,3.6,2,False
05-12-2025 16:00,52.089770561127374,5.109876746789877,2025-12-05T17:00:00+01:00,3511,code_yellow,3,4.9,1,True
05-12-2025 16:00,52.089770561127374,5.109876746789877,2025-12-05T23:00:00+01:00,3511,code_yellow,3,4.9,1,True
05-12-2025 16:00,52.089770561127374,5.109876746789877,2025-12-06T05:00:00+01:00,3511,code_yellow,3,4.9,1,False
05-12-2025 16:00,52.089770561127374,5.109876746789877,2025-12-06T11:00:00+01:00,3511,code_yellow,3,4.9,1,False
05-12-2025 22:00,52.089770561127374,5.109876746789877,2025-12-05T23:00:00+01:00,3511,code_yellow,4,7.0,1,True
05-12-2025 22:00,52.089770561127374,5.109876746789877,2025-12-06T05:00:00+01:00,3511,code_yellow,4,7.0,1,True
05-12-2025 22:00,52.089770561127374,5.109876746789877,2025-12-06T11:00:00+01:00,3511,code_yellow,4,7.0,1,False
05-12-2025 22:00,52.089770561127374,5.109876746789877,2025-12-06T17:00:00+01:00,3511,code_yellow,4,7.0,1,False
06-12-2025 04:00,52.089770561127374,5.109876746789877,2025-12-06T05:00:00+01:00,3511,code_yellow,4,6.0,1,True
06-12-2025 04:00,52.089770561127374,5.109876746789877,2025-12-06T11:00:00+01:00,3511,code_yellow,4,6.0,1,True
06-12-2025 04:00,52.089770561127374,5.109876746789877,2025-12-06T17:00:00+01:00,3511,code_yellow,4,6.0,1,False
06-12-2025 04:00,52.089770561127374,5.109876746789877,2025-12-06T23:00:00+01:00,3511,code_yellow,4,6.0,1,False
06-12-2025 10:00,52.089770561127374,5.109876746789877,2025-12-06T11:00:00+01:00,3511,code_yellow,4,5.9,1,True
06-12-2025 10:00,52.089770561127374,5.109876746789877,2025-12-06T17:00:00+01:00,3511,code_yellow,4,5.9,1,True
06-12-2025 10:00,52.089770561127374,5.109876746789877,2025-12-06T23:00:00+01:00,3511,code_yellow,4,5.9,1,False
06-12-2025 10:00,52.089770561127374,5.109876746789877,2025-12-07T05:00:00+01:00,3511,code_yellow,4,5.9,1,False
06-12-2025 16:00,52.089770561127374,5.109876746789877,2025-12-06T17:00:00+01:00,3511,code_yellow,4,6.5,1,True
06-12-2025 16:00,52.089770561127374,5.109876746789877,2025-12-06T23:00:00+01:00,3511,code_yellow,4,6.5,1,True
06-12-2025 16:00,52.089770561127374,5.109876746789877,2025-12-07T05:00:00+01:00,3511,code_yellow,4,6.5,1,False
06-12-2025 16:00,52.089770561127374,5.109876746789877,2025-12-07T11:00:00+01:00,3511,code_yellow,4,6.5,1,False
06-12-2025 22:00,52.089770561127374,5.109876746789877,2025-12-06T23:00:00+01:00,3511,code_yellow,4,5.5,1,True
06-12-2025 22:00,52.089770561127374,5.109876746789877,2025-12-07T05:00:00+01:00,3511,code_yellow,4,5.5,1,True
06-12-2025 22:00,52.089770561127374,5.109876746789877,2025-12-07T11:00:00+01:00,3511,code_yellow,4,5.5,1,False
06-12-2025 22:00,52.089770561127374,5.109876746789877,2025-12-07T17:00:00+01:00,3511,code_yellow,4,5.5,1,False
07-12-2025 04:00,52.089770561127374,5.109876746789877,2025-12-07T05:00:00+01:00,3511,code_yellow,3,4.3,1,True
07-12-2025 04:00,52.089770561127374,5.109876746789877,2025-12-07T11:00:00+01:00,3511,code_yellow,3,4.3,1,True
07-12-2025 04:00,52.089770561127374,5.109876746789877,2025-12-07T17:00:00+01:00,3511,code_yellow,3,4.3,1,False
07-12-2025 04:00,52.089770561127374,5.109876746789877,2025-12-07T23:00:00+01:00,3511,code_yellow,3,4.3,1,False
07-12-2025 10:00,52.089770561127374,5.109876746789877,2025-12-07T11:00:00+01:00,3511,code_yellow,3,4.5,1,True
07-12-2025 10:00,52.089770561127374,5.109876746789877,2025-12-07T17:00:00+01:00,3511,code_yellow,3,4.5,1,True
07-12-2025 10:00,52.089770561127374,5.109876746789877,2025-12-07T23:00:00+01:00,3511,code_yellow,3,4.5,1,False
07-12-2025 10:00,52.089770561127374,5.109876746789877,2025-12-08T05:00:00+01:00,3511,code_yellow,3,4.5,1,False
07-12-2025 16:00,52.089770561127374,5.109876746789877,2025-12-07T17:00:00+01:00,3511,code_yellow,4,6.9,1,True
07-12-2025 16:00,52.089770561127374,5.109876746789877,2025-12-07T23:00:00+01:00,3511,code_yellow,4,6.9,1,True
07-12-2025 16:00,52.089770561127374,5.109876746789877,2025-12-08T05:00:00+01:00,3511,code_yellow,4,6.9,1,False
07-12-2025 16:00,52.089770561127374,5.109876746789877,2025-12-08T11:00:00+01:00,3511,code_yellow,4,6.9,1,False
07-12-2025 22:00,52.089770561127374,5.109876746789877,2025-12-07T23:00:00+01:00,3511,code_yellow,4,5.8,1,True
07-12-2025 22:00,52.089770561127374,5.109876746789877,2025-12-08T05:00:00+01:00,3511,code_yellow,4,5.8,1,True
07-12-2025 22:00,52.089770561127374,5.109876746789877,2025-12-08T11:00:00+01:00,3511,code_yellow,4,5.8,1,False
07-12-2025 22:00,52.089770561127374,5.109876746789877,2025-12-08T17:00:00+01:00,3511,code_yellow,4,5.8,1,False
08-12-2025 04:00,52.089770561127374,5.109876746789877,2025-12-08T05:00:00+01:00,3511,code_yellow,3,4.5,1,True
08-12-2025 04:00,52.089770561127374,5.109876746789877,2025-12-08T11:00:00+01:00,3511,code_yellow,3,4.5,1,True
08-12-2025 04:00,52.089770561127374,5.109876746789877,2025-12-08T17:00:00+01:00,3511,code_yellow,3,4.5,1,False
08-12-2025 04:00,52.089770561127374,5.109876746789877,2025-12-08T23:00:00+01:00,3511,code_yellow,3,4.5,1,False
08-12-2025 10:00,52.089770561127374,5.109876746789877,2025-12-08T11:00:00+01:00,3511,code_yellow,4,5.5,1,True
08-12-2025 10:00,52.089770561127374,5.109876746789877,2025-12-08T17:00:00+01:00,3511,code_yellow,4,5.5,1,True
08-12-2025 10:00,52.089770561127374,5.109876746789877,2025-12-08T23:00:00+01:00,3511,code_yellow,4,5.5,1,False
08-12-2025 10:00,52.089770561127374,5.109876746789877,2025-12-09T05:00:00+01:00,3511,code_yellow,4,5.5,1,False
08-12-2025 16:00,52.089770561127374,5.109876746789877,2025-12-08T17:00:00+01:00,3511,code_yellow,3,4.6,1,True
08-12-2025 16:00,52.089770561127374,5.109876746789877,2025-12-08T23:00:00+01:00,3511,code_yellow,3,4.6,1,True
08-12-2025 16:00,52.089770561127374,5.109876746789877,2025-12-09T05:00:00+01:00,3511,code_yellow,3,4.6,1,False
08-12-2025 16:00,52.089770561127374,5.109876746789877,2025-12-09T11:00:00+01:00,3511,code_yellow,3,4.6,1,False
08-12-2025 22:00,52.089770561127374,5.109876746789877,2025-12-08T23:00:00+01:00,3511,code_yellow,3,3.8,1,True
08-12-2025 22:00,52.089770561127374,5.109876746789877,2025-12-09T05:00:00+01:00,3511,code_yellow,3,3.8,1,True
08-12-2025 22:00,52.089770561127374,5.109876746789877,2025-12-09T11:00:00+01:00,3511,code_yellow,3,3.8,1,False
08-12-2025 22:00,52.089770561127374,5.109876746789877,2025-12-09T17:00:00+01:00,3511,code_yellow,3,3.8,1,False
09-12-2025 04:00,52.089770561127374,5.109876746789877,2025-12-09T05:00:00+01:00,3511,code_yellow,3,4.5,1,True
09-12-2025 04:00,52.089770561127374,5.109876746789877,2025-12-09T11:00:00+01:00,3511,code_yellow,3,4.5,1,True
09-12-2025 04:00,52.089770561127374,5.109876746789877,2025-12-09T17:00:00+01:00,3511,code_yellow,3,4.5,1,False
09-12-2025 04:00,52.089770561127374,5.109876746789877,2025-12-09T23:00:00+01:00,3511,code_yellow,3,4.5,1,False
09-12-2025 10:00,52.089770561127374,5.109876746789877,2025-12-09T11:00:00+01:00,3511,code_yellow,3,5.3,1,True
09-12-2025 10:00,52.089770561127374,5.109876746789877,2025-12-09T17:00:00+01:00,3511,code_yellow,3,5.3,1,True
09-12-2025 10:00,52.089770561127374,5.109876746789877,2025-12-09T23:00:00+01:00,3511,code_yellow,3,5.3,1,False
09-12-2025 10:00,52.089770561127374,5.109876746789877,2025-12-10T05:00:00+01:00,3511,code_yellow,3,5.3,1,False
09-12-2025 16:00,52.089770561127374,5.109876746789877,2025-12-09T17:00:00+01:00,3511,code_yellow,4,5.6,1,True
09-12-2025 16:00,52.089770561127374,5.109876746789877,2025-12-09T23:00:00+01:00,3511,code_yellow,4,5.6,1,True
09-12-2025 16:00,52.089770561127374,5.109876746789877,2025-12-10T05:00:00+01:00,3511,code_yellow,4,5.6,1,False
09-12-2025 16:00,52.089770561127374,5.109876746789877,2025-12-10T11:00:00+01:00,3511,code_yellow,4,5.6,1,False
09-12-2025 22:00,52.089770561127374,5.109876746789877,2025-12-09T23:00:00+01:00,3511,code_yellow,4,5.8,1,True
09-12-2025 22:00,52.089770561127374,5.109876746789877,2025-12-10T05:00:00+01:00,3511,code_yellow,4,5.8,1,True
09-12-2025 22:00,52.089770561127374,5.109876746789877,2025-12-10T11:00:00+01:00,3511,code_yellow,4,5.8,1,False
09-12-2025 22:00,52.089770561127374,5.109876746789877,2025-12-10T17:00:00+01:00,3511,code_yellow,4,5.8,1,False
10-12-2025 04:00,52.089770561127374,5.109876746789877,2025-12-10T05:00:00+01:00,3511,code_yellow,3,4.5,1,True
10-12-2025 04:00,52.089770561127374,5.109876746789877,2025-12-10T11:00:00+01:00,3511,code_yellow,3,4.5,1,True
10-12-2025 04:00,52.089770561127374,5.109876746789877,2025-12-10T17:00:00+01:00,3511,code_yellow,3,4.5,1,False
10-12-2025 04:00,52.089770561127374,5.109876746789877,2025-12-10T23:00:00+01:00,3511,code_yellow,3,4.5,1,False
10-12-2025 10:00,52.089770561127374,5.109876746789877,2025-12-10T11:00:00+01:00,3511,code_yellow,4,6.3,1,True
10-12-2025 10:00,52.089770561127374,5.109876746789877,2025-12-10T17:00:00+01:00,3511,code_yellow,4,6.3,1,True
10-12-2025 10:00,52.089770561127374,5.109876746789877,2025-12-10T23:00:00+01:00,3511,code_yellow,4,6.3,1,False
10-12-2025 10:00,52.089770561127374,5.109876746789877,2025-12-11T05:00:00+01:00,3511,code_yellow,4,6.3,1,False
